377,"blame dragging one responsible turning knife part tradition laugh down truth told told",2010-02-27 23:01:15,133,1,-
377,"pretty stoke weekend debrief meeting bowling linguist drake dung concert calvary church family dinner see coffee smile",2010-07-30 22:50:17,133,1,-
377,"show truly choice professor dumbledore",2010-11-16 15:00:51,133,1,-
377,"current favorite song life wo wait oozy smile",2010-09-28 22:09:20,133,1,-
377,"light faster anything wrong matter fast light darkness always first waiting ratchety",2010-10-25 15:30:54,133,1,-
377,"laugh mother day those wonderful moss especially love",2010-05-09 13:27:54,133,1,-
377,"road crazy break stand close matter still oh thank god go still",2010-04-19 00:54:18,133,1,-
377,"ground body lay light world darkness slain forth glorious day up grave again victory sin curse lost grip mine bought precious blood christ laugh easter ya",2010-04-04 23:14:26,133,1,-
377,"tractor",2010-04-24 12:36:25,133,1,-
377,"felt getting guitar singing bout baby sing ai love song",2010-09-02 19:28:38,133,1,-
377,"done done done semester mu summer begin smile",2010-05-05 14:46:16,133,1,-
377,"wan na waste another summer wan na wait until fall memory tomorrow nothing know doing laugh landed space good place",2010-10-18 15:21:18,133,1,-
377,"trust movement life laugh level trust movement alfred",2010-04-05 17:15:39,133,1,-
377,"wow change jiffy christmas shopping mother turned two strander somewhere along highway",2010-12-20 16:40:39,133,1,-
377,"home laugh out place lord wo give strength make through somehow never more homesick now laugh lord understand ways love",2010-10-01 15:12:39,133,1,-
377,"lower e playful people less laugh l",2010-04-11 13:47:03,133,1,-
377,"ask world needs ask come alive go world needs people come alive howard",2010-09-13 15:43:13,133,1,-
377,"th smile",2010-05-04 22:16:28,133,1,-
377,"classes today university second semester smile",2010-08-30 11:37:37,133,1,-
377,"yes department begun christmas music smile",2010-11-07 20:34:08,133,1,-
377,"thus far think finally time give plus perfect day begin listening christmas music smile",2010-10-19 14:38:50,133,1,-
377,"soldier someone one point life wrote blank check made payable united amount up life honor way many people country today longer understand fact thankful n soldier",2010-04-26 17:51:46,133,1,-
377,"goes still give ourselves ca spend waiting live",2010-04-29 14:14:10,133,1,-
377,"pa new york woman around take girl gutta ca take gutta girl spending next few days county fair family love",2010-08-11 12:10:34,133,1,-
377,"doing fine always landing nice time skin teeth gon na stress cause worst laugh something watching over sweet serendipity smile life busy morning hope dinner movie english final laugh move landplane church party shopping mother birthday whew",2010-12-17 17:55:15,133,1,-
377,"against grain way life worth price always worth fight second second try",2010-10-13 15:37:34,133,1,-
377,"laugh boy mind taking home tonight ai seen country boy truck high hold tight gon na wilder second ride wink",2010-05-11 18:00:05,133,1,-
377,"come mu really cancel already lymph blah",2011-01-26 13:13:33,133,1,-
377,"road trip carlisle d c today see everything out praying best smile",2010-11-09 13:04:14,133,1,-
377,"sometimes pooh take up room laugh love",2010-07-27 14:06:50,133,1,-
377,"number name",2010-05-12 12:54:02,133,1,-
377,"saturday bonfire much sunday c picnic movie monday cookout holiday begin wink",2010-05-29 23:38:52,133,1,-
377,"lost darkness learn steer time gutter turn look o",2010-05-25 12:58:19,133,1,-
377,"wan na paint outside run red mind take everything one lifetime give wan na stand inside fire walk blindfolded wire man man",2010-09-10 15:21:02,133,1,-
377,"pretend airplane night sky shooting really use wish right now wish right now wish right now o",2010-06-15 21:01:51,133,1,-
377,"vermont new york visit smile",2010-06-03 12:44:45,133,1,-
377,"satisfy love more enough love",2010-09-19 21:49:40,133,1,-
377,"c retreat weekend smile",2010-09-17 20:49:53,133,1,-
377,"beach south carolina vacation family",2010-05-16 21:45:33,133,1,-
377,"supposed start senior year mu tomorrow delay winter weather calling",2011-01-18 01:27:53,133,1,-
377,"meeting prayerfully considering opportunity go trip peru love",2010-07-26 17:04:58,133,1,-
377,"",2011-01-23 19:24:32,133,1,-
377,"wide look same sense wonder child laugh kiss",2010-07-05 13:51:23,133,1,-
377,"love gon na live gon na want world pass gon na dream aint gon na life lie wan na love",2010-06-10 00:24:18,133,1,-
377,"thanks bing found out one favorite childhood dittied actually great fire",2010-10-08 15:07:37,133,1,-
377,"wonderful murder mystery party last night chilly today conference thing church tonight church tomorrow agha weekend gone",2010-11-13 11:44:10,133,1,-
377,"much traffic debris traffic out flooded want home",2010-05-31 23:54:30,133,1,-
377,"ladder family reunion lipide brunch love wish allamanda laugh smile",2010-07-03 02:15:09,133,1,-
377,"going see drive tonight smile",2010-06-26 22:01:12,133,1,-
377,"well declare first time come home hunting without deer sad still saturday shoot smile",2010-12-05 21:55:57,133,1,-
377,"great gift family life intimately acquainted people never even introduce yourself life done",2010-08-02 02:07:00,133,1,-
377,"love felt pain laugh want tell keep find love love",2010-08-05 17:40:49,133,1,-
377,"amt smile",2010-09-26 22:40:34,133,1,-
377,"wheel forth daytime kiss",2010-06-23 23:01:11,133,1,-
377,"wondering sweet tomorrow jagged past love",2010-06-29 23:31:34,133,1,-
377,"love marry today day marry nerve laugh promise always laugh side promise sing music love",2011-02-08 17:08:09,133,1,-
377,"home again home again sight uncle going laugh weekend smile",2010-07-23 22:54:09,133,1,-
377,"time still wo lose long way down slowly grand nobbut somewhere soul know running worry still learning fall want walk before crawl still learning fall love theft love",2010-08-31 13:52:18,133,1,-
377,"screening selection interview today determine continue social work program graduate next spring",2011-01-25 12:49:55,133,1,-
377,"man laugh without delusion kind necessary laugh christian nevel boree kiss",2010-07-11 22:44:20,133,1,-
377,"week love",2010-07-17 12:26:28,133,1,-
377,"beautiful rain bible study laugh pyr old praising god catching up friend laughter steeler won jeans long psych family charging solitude wonderful sunday",2010-09-12 20:33:37,133,1,-
377,"ah work finished around now success kids bed leaving mess around new lawton smile",2011-01-14 01:56:45,133,1,-
377,"ah friday chilly visit vanity jones drop drake airport home again fun evening gang smile",2011-02-11 12:56:41,133,1,-
377,"laugh praise god such wonderful sunday smile",2010-07-25 19:48:50,133,1,-
377,"fall break state game walking sunday morning family togetherness time christmas shopping mother school again over soon",2010-10-08 21:46:15,133,1,-
377,"being mean something important",2011-02-14 02:46:12,133,1,-
377,"ready day laugh park smile",2010-08-21 13:12:55,133,1,-
377,"little brother boyer turning today smile",2010-08-27 10:24:49,133,1,-
377,"enjoy doing dumb sick ie apparently thought good idea put cell phone through wash load ergot now suffer cell few days sad",2010-08-03 20:55:28,133,1,-
377,"sleeping stead keeping late keeping ugh ca fall asleep tired effectively study psych final fear going long day indecision",2010-12-15 07:19:14,133,1,-
377,"replacement phone lost ugh technology",2010-08-04 19:45:36,133,1,-
377,"love rainy smile",2010-09-28 13:43:24,133,1,-
377,"thanks everyone birthday smile",2010-09-08 14:59:06,133,1,-
377,"homework night work flashlight maze bonfire church steeler much homework life slow down",2010-10-15 20:56:59,133,1,-
377,"down knesset pray o lordlet see another between raising laugh amazing grace",2010-08-16 13:21:21,133,1,-
377,"laugh lots sledding hill road late night despicable tournament polish singsong laughing act people ho ah lander smile",2010-12-28 21:07:46,133,1,-
377,"anything change indone sunset one turn around come back laugh time love",2010-08-23 12:26:14,133,1,-
377,"out shooting ready hunting next week instead doing shopping black friday",2010-11-26 14:59:10,133,1,-
377,"officially thanksgiving break smile going week family food sleep shopping writing",2010-11-22 19:28:25,133,1,-
377,"weekend raise flag see boyer smile",2010-11-05 17:41:37,133,1,-
377,"thanks life countless playful skipping school today go down vice perry see vanity jones smile",2010-11-08 13:13:25,133,1,-
377,"lameter fair school ephraim fair work impact now weekend laugh toddler sleep steeler game birthday dinner family felty gon na busy weekend smile",2010-09-23 21:16:42,133,1,-
377,"lander take hunting coming ya lipide lots time family smile",2010-12-10 20:14:59,133,1,-
377,"less actual classes still write conduct give even know many little",2010-11-18 15:15:27,133,1,-
377,"always wondering",2010-11-29 01:32:15,133,1,-
377,"laugh new year smile",2010-01-01 05:04:57,133,1,-
377,"lancaster laugh lander few wonderful days hunting time spent family course lipide smile",2010-12-02 00:03:33,133,1,-
377,"telling right thing climbing out window house",2010-11-01 16:40:32,133,1,-
377,"thankful great weekend awesome people smile chilly now spending tomorrow boyer smile",2011-01-10 18:07:09,133,1,-
377,"well first week school come end already complete stranger put speed oh wonder rest semester bring smile",2011-01-21 15:11:38,133,1,-
377,"live die invest love invest life awake soul made meet",2011-01-03 14:39:18,133,1,-
377,"kind moment time perfect day day earth stood think lying alone know know going through cut cant seem go wonder know know part still waiting",2010-12-21 15:14:43,133,1,-
377,"impact winter retreat woohoo smile",2011-01-14 21:07:54,133,1,-
377,"fumbling life begin end instant family christmas set mother family dad aunt dad hospital god turn out right now bittersweet season",2010-12-23 02:23:59,133,1,-
377,"difference between right word right word difference between lightning lightning bug twain",2010-12-13 14:31:26,133,1,-
377,"really making diversity class tonight up taking pitcher homemade switchel smile",2010-12-16 22:21:38,133,1,-
377,"laugh go steeler laugh go going supersoil smile",2011-02-06 22:05:33,133,1,-
377,"love laugh day laugh day washed sin away oh laugh day laugh day never same forever laugh praise lord dad saved love",2011-02-02 15:07:30,133,1,-
377,"ah beautiful day open listen country music spring clean room smile",2011-02-17 17:10:03,133,1,-
377,"school today netcha smile",2011-02-18 12:23:04,133,1,-
377,"bring bring flight plan angel gone skies blue looking found smile",2011-02-20 20:39:25,133,1,-
377,"officially going dominican republic summer lovely jessamy mocmain work smile",2011-02-24 22:30:44,133,1,-
377,"speak rhythm speak code thank berlin playful",2011-03-04 01:46:26,133,1,-
377,"spring break begun smile",2011-03-04 14:53:00,133,1,-
377,"sometimes laugh old earth shouting through wind thats climb up laugh look through god now ca fly two high up laugh above noise city streets ah visiting family lander spring break love",2011-03-08 16:20:20,133,1,-
377,"laugh acceptance letter mu social work department graduate next year smile",2011-03-13 20:01:39,133,1,-
377,"starlight make take nights went far broke laugh close knew know thank god cause led laugh love",2011-03-21 18:09:05,133,1,-
377,"laid bed night thought day life roller coaster ride up down crazy turns along way throw hold tight ca really smile until shed die today live love crazy tragic sometimes magic awful beautiful life smile",2011-03-28 01:24:11,133,1,-
377,"oh quickly change yaya watching ironman jenny boyer doing smile",2011-04-07 18:47:50,133,1,-
377,"tell world coming home rain wash away pain yesterday know kingdom coming home coming home tell world coming home smile",2011-04-13 17:21:49,133,1,-
377,"stand arms high laugh abandoned awe one gave stand soul lord yours",2011-04-20 02:06:52,133,1,-
377,"beauty cross one soul beauty cross finally free go beauty cross grace found",2011-04-23 03:24:56,133,1,-
377,"laugh christ risen smile easter dad first believer favoritism easter present winchester smile",2011-04-24 21:25:50,133,1,-
377,"ah final week due final poster presentation group conference respite care plus normal weekly saturday indecision",2011-05-02 01:15:57,133,1,-
377,"looking need clarity people counting tired up against wall lord laugh call laugh know up laugh know care life toll laugh soul doing best oh lord laugh prayer common man lord laugh prayer common wo man love",2011-05-09 17:07:43,133,1,-
378,"bass love",2010-10-04 08:55:43,108,0,-
378,"cinque quest facile con la persona gist e new grade gusto moment gusto e per lo scope gusto e new mood gusto quest non di cinque e non facile unique soon mi approval laugh",2010-08-26 23:22:31,108,0,-
378,"cargo non soon state furioso di porch e poi bacca e poi",2010-08-26 19:48:25,108,0,-
378,"che mess secreto laugh",2011-01-20 15:16:20,108,0,-
378,"facula zerda che non matti audio second part de film surprise",2011-01-26 20:02:11,108,0,-
378,"de chara italon ho finite bokard ga ita",2010-11-08 16:57:30,108,0,-
378,"chara italon tu con child u andrea gerard soon",2011-01-31 21:56:40,108,0,-
378,"essene upcity da romanza di surprise",2010-11-27 15:14:48,108,0,-
378,"",2010-10-28 20:52:14,108,0,-
378,"something wrong level perfection needs",2010-11-23 20:05:35,108,0,-
378,"la scagliola",2010-10-18 17:48:57,108,0,-
378,"love la pommy",2010-10-21 15:40:44,108,0,-
378,"aviso domain con la cava mi che visto che ho di feeble",2010-10-26 18:22:14,108,0,-
378,"feste civet cell income classic siam fight non diiamb ho person o massive perfidy se procris santiago boni echo che serve paper grece",2010-08-05 19:08:42,108,0,-
378,"non crednerite soon append tornado da unborn di cora non state poi smile",2010-08-25 18:44:34,108,0,-
378,"e domain commit sero o se agile da em peso",2010-10-12 17:35:13,108,0,-
378,"odd quare id facial foretaste see fiery sent excruciator",2010-11-28 21:13:49,108,0,-
378,"miles de de marcher",2010-10-21 14:48:04,108,0,-
378,"oh love friend wish something wish something more",2010-09-06 17:59:32,108,0,-
378,"maestro sa cost dice wide signory dice null venie aniente di personal signory continue pure",2011-01-13 22:29:53,108,0,-
378,"parto per",2010-08-19 06:37:23,108,0,-
378,"day metallic helobious monk passado per e poplin love",2010-10-05 15:10:44,108,0,-
378,"domain di quinic ore pullman con sist e poi case la matting tutti da",2010-08-20 15:52:33,108,0,-
378,"ohio zattare",2010-08-10 19:59:42,108,0,-
378,"che",2010-10-19 17:24:42,108,0,-
378,"mi coelata la media motto dinitro crying",2010-10-13 19:49:49,108,0,-
378,"perianth aware non aware e",2010-11-25 22:00:16,108,0,-
378,"avert girny e e non andre schola s possible conservatorio procris october quest che da bass",2010-10-05 20:11:48,108,0,-
378,"jetsam nebel wander ist vein bench kent den aldern seder ist mallein laugh laugh",2010-12-02 22:13:29,108,0,-
378,"adrian surprise",2010-10-26 17:01:34,108,0,-
378,"case per fu",2010-09-08 11:15:43,108,0,-
378,"thinking lot lately convinced making sky blue good idea",2010-12-27 23:39:55,108,0,-
378,"ohio computer",2010-10-15 20:03:39,108,0,-
378,"cento vote beat si abandon fee mess la mete trove pace cure come andante abrico dormitory quanta pen induce precede tutti coli cut non girl la testa laugh ohio tutti gest tutti part di cut laugh cure e vibrato",2010-09-05 20:26:21,108,0,-
378,"alea acta",2010-11-16 20:38:17,108,0,-
378,"la cantata mandible surprise",2010-09-18 12:16:40,108,0,-
378,"fine mi soon",2010-08-03 11:18:23,108,0,-
378,"non schola la direct salt di torture non si sent alto che lo belle serve lo streite belle verge gemuti e finance poison impair bambini se non dare la culture baruch spinous",2010-08-23 19:10:17,108,0,-
378,"horse fat see imago o sera agar mi far mimi penster s null sterno e instant fugue quest red tempo e con lui cure one eli si struggle e io guardo la tua pace dome quell spirt mi rugged",2010-08-25 16:59:22,108,0,-
378,"per te di se trover mollie se non la trover per macco cell ache con te laugh",2010-08-26 23:38:22,108,0,-
378,"cost divoto mi soon fu gutta estate deva aver press batta testa",2010-08-25 14:37:25,108,0,-
378,"disputer e la parole e convene che la religion nova di ad voice che pain di stimuli inferior e ache di motto fu santo che public slender dal sodio scorpio piano cell di si para",2010-08-25 09:16:32,108,0,-
378,"concerto ridicule vienna",2010-08-18 21:17:15,108,0,-
378,"homo hominy lupus",2010-09-28 17:40:53,108,0,-
378,"",2010-09-16 20:28:13,108,0,-
378,"chat sommaite son e sa chat passant pari amid en route quell ne vive",2010-08-22 18:14:07,108,0,-
378,"color che icon che come far che loro si avert want",2010-08-30 22:18:06,108,0,-
378,"essay agnes dieri concordant senso",2010-11-17 17:44:17,108,0,-
378,"la e noise se dice che mete",2010-08-19 16:57:30,108,0,-
378,"fit laugh ignobility argus se credent wiros audile value latus cessor center vital servant munia ectomere hic ubi opium brisque e playful lit hellebore dorsum credit ad see amini non ait sic extort voluptas per vim metis error",2010-12-31 15:32:55,108,0,-
378,"tutti di prima che fare la version cava ripa future perfecto optative medio che non fatty basta andre pay verb e si traduce con ravinate",2010-09-17 13:29:33,108,0,-
378,"patesi b e b q test ab b ana ba per prime principia di equivalent belle ba ba b ab bob per prime principia di equivalent belle ab b ab conserve che ab b",2010-09-19 13:54:59,108,0,-
378,"e si score che monsoni non bone scriver poesie mi sa che concurso con la farsi trigger men che non portia resina sulla rob simile",2010-09-14 19:42:10,108,0,-
378,"cargo fastidious guardant biretta precise moment perversely la scatty",2010-10-14 19:26:03,108,0,-
378,"si retire per guardant punctate di make break pari con folding",2010-08-27 21:08:11,108,0,-
378,"yee novo di capella",2010-10-15 13:36:01,108,0,-
378,"soon tornado case pullman di ore lett",2010-08-21 23:15:14,108,0,-
378,"unultra petition state fatty per far entire age ing se obbligato tutti ego state humoristical e di per statal",2010-11-16 14:15:24,108,0,-
378,"soon irritate surprise",2010-10-30 16:58:48,108,0,-
378,"andre severe inception tutti quell che visto laugh ditto che e soon curioso",2010-09-26 18:10:14,108,0,-
378,"de ma la che trema menald teco sea dictate quell ti mado de present rostra per star con vol partite da rolliche fu servo",2011-01-14 21:03:42,108,0,-
378,"long men breathe see long life thee",2010-10-09 22:19:59,108,0,-
378,"",2011-03-10 16:29:55,108,0,-
378,"si best quod james presto simulacra taken sunt illium ad",2010-10-17 17:26:18,108,0,-
378,"se tu non mi non import soon grade di aware per tutti e due laugh",2010-09-20 18:28:47,108,0,-
378,"essay cell chara italon",2010-12-23 14:23:29,108,0,-
378,"flatus ergot solidus",2010-10-11 13:16:38,108,0,-
378,"persian cell folding laugh vedism indoline laugh",2011-03-16 18:53:44,108,0,-
378,"folding persian cell ho visto gutta la punctate di glee ancora love di laugh",2011-03-16 23:34:01,108,0,-
378,"da lo psilology",2010-10-17 13:15:15,108,0,-
378,"chara italon de angles proposition di eventually revealed mother laugh reappear four later living yamato still panama ohio",2010-11-08 17:00:18,108,0,-
378,"soon e mi sent come se foster surprise che",2010-10-13 18:21:15,108,0,-
378,"",2011-03-24 18:49:34,108,0,-
378,"thereto eve fare quest inventary e mood mano very artist tutti soon tema laugh pock important mood tutti invert new prendre tema bana e graze hello st new pure delsarte",2011-03-27 19:13:24,108,0,-
378,"dieri agnes dieri miglio se ne anna sad",2011-01-25 14:38:46,108,0,-
378,"gambia gambia gambia gambia gambia gambia gambia rabbit gambia rabbit eugene si latin",2010-09-20 19:18:29,108,0,-
378,"folding agnes dieri",2011-01-27 21:56:56,108,0,-
378,"si best quod james presto simulacra taken sunt illium ad",2011-02-10 18:52:18,108,0,-
378,"di latin da studite quasi soon surprise",2010-11-04 13:23:00,108,0,-
378,"mi dire tritolo version per la",2010-09-29 13:21:25,108,0,-
378,"girl e more",2010-11-21 13:26:21,108,0,-
378,"vened yoky",2011-04-05 20:22:17,108,0,-
378,"wonder bibber willing join underground fight club",2010-11-16 20:15:39,108,0,-
378,"know more share babe",2010-10-07 20:05:42,108,0,-
378,"yee soon di anti due",2010-10-10 18:46:45,108,0,-
378,"schola di miles labor sulla triceria di duel principia prime che base di cost balete lo con con apeiron con laria e con bass bene bene laugh",2010-10-11 13:45:59,108,0,-
378,"yee soon si saphena cause bass",2010-10-06 10:37:51,108,0,-
378,"scopine november che certain di latin quest da classic surprise",2010-11-03 13:41:29,108,0,-
378,"ho append coperta che sister sort di che para solo di glee ohio",2010-10-31 12:37:27,108,0,-
378,"vote undate di col trio soon divvers laugh",2010-11-02 21:39:17,108,0,-
378,"domain elissa partial di sole",2011-01-03 13:01:11,108,0,-
378,"chara italon de che pale deva studite paper come finished e takeuchi che playful",2010-11-07 21:33:29,108,0,-
378,"se chemical ancora per po vomiture humeri di avocado",2010-11-28 18:50:04,108,0,-
378,"fulgide imagine e via da che aliment e volery la mete ad alto slander anti corps quasi che piano e non essence revolt volta per persona sola e e secure dolose",2011-02-07 21:35:35,108,0,-
378,"guardant minute di video attend minute o far click per epic fail surprise",2010-12-01 22:24:12,108,0,-
378,"mi soon gigliato capella",2010-12-17 20:08:10,108,0,-
378,"cell ho append finite di severe due film trash persico per latro induce casino te lo severe laugh",2011-01-23 00:06:01,108,0,-
378,"cell chara italon che da",2010-12-30 09:34:58,108,0,-
378,"see fugitate decent simulacra paula jibi true converter mantelet sincere more corpora retinene semen converse amoret servage jibi cram dolores",2011-01-25 22:45:52,108,0,-
378,"michael essay smile x da new y di men soon tanti tu parole",2011-01-16 22:41:06,108,0,-
378,"quest accuse non ignore che mi motto motto tire devil article age sulla stamp che p ice offense di che mi spongy e latro che io compo non che mezzo per acre rare e giustina ho boltant passion quell luce nome che laugh santo e che laugh dipetto",2011-01-13 21:08:02,108,0,-
378,"metrics greta",2011-02-01 16:12:15,108,0,-
378,"che agaze series soon duel che fanny rider",2011-01-23 20:17:21,108,0,-
378,"death now phoenix nest turtle loyal breast eternity rest",2011-04-15 19:10:05,108,0,-
378,"folding cell persian la nova p data di glee fa po schinus",2011-04-20 19:00:20,108,0,-
378,"d model think yes think more fun being psychologist pretty enough yes",2011-05-02 19:43:08,108,0,-
378,"second nome di pia tutti si surprise",2011-05-06 11:07:03,108,0,-
378,"cell folding persian la nova punctate di glee indefinable",2011-05-11 16:53:59,108,0,-
366,"fed up think going very well tomorrow",2009-06-16 21:31:32,1174,1,-
366,"hiccup",2009-06-22 21:37:51,1174,1,-
366,"really perspective grr",2009-06-14 15:24:49,1174,1,-
366,"more left go more left go now more left go more left goo n nirvana spa laugh",2009-06-17 15:22:07,1174,1,-
366,"sad day",2009-06-19 13:22:44,1174,1,-
366,"two exam left now happy",2009-06-15 15:24:55,1174,1,-
366,"e playful chip butty smile",2009-06-23 11:37:04,1174,1,-
366,"back",2009-07-10 23:16:18,1174,1,-
366,"needs start spending less money",2009-07-18 19:06:30,1174,1,-
366,"nauseous sad",2009-07-11 20:28:43,1174,1,-
366,"route friday smile",2009-07-12 18:34:06,1174,1,-
366,"new smile",2009-07-19 17:02:23,1174,1,-
366,"potter great lovely time",2009-07-17 21:20:37,1174,1,-
366,"left wondering laugh",2009-08-22 22:05:13,1174,1,-
366,"cat eat pear",2009-07-22 17:02:02,1174,1,-
366,"dad getting player guess going put many computer onto",2009-07-28 23:31:12,1174,1,-
366,"time artiness think smile",2009-07-24 17:01:41,1174,1,-
366,"angry fed up feeling well",2009-07-30 14:39:28,1174,1,-
366,"really hurt really laugh last night smile",2009-08-02 11:34:08,1174,1,-
366,"nauseous smile",2009-07-11 20:28:30,1174,1,-
366,"going yoga smile",2009-08-11 20:20:57,1174,1,-
366,"smile",2009-06-18 12:56:21,1174,1,-
366,"watching total without laugh",2009-08-22 17:53:21,1174,1,-
366,"one week left go oh god",2009-08-13 12:30:40,1174,1,-
366,"oh god oh god oh god going laugh",2009-08-20 07:58:04,1174,1,-
366,"laugh laugh desk lamp coz ca see keyboard",2009-08-25 19:19:27,1174,1,-
366,"feeling very insightful today",2009-07-28 20:07:23,1174,1,-
366,"cant knit make bloody plum make sponge cake",2009-08-30 21:53:55,1174,1,-
366,"glad home even though pain",2009-08-05 20:45:18,1174,1,-
366,"really laugh",2009-08-30 20:20:25,1174,1,-
366,"holiday week bye bye",2009-09-03 08:52:07,1174,1,-
366,"getting ready holiday",2009-09-02 21:43:32,1174,1,-
366,"understand people shop bay",2009-08-09 20:55:05,1174,1,-
366,"love chocolate looking trying bread smile",2009-08-10 18:47:07,1174,1,-
366,"laugh days laugh",2009-09-12 10:39:09,1174,1,-
366,"whether",2009-09-12 19:59:54,1174,1,-
366,"feeling bit",2009-07-16 16:38:50,1174,1,-
366,"feeling very well sad",2009-09-11 16:05:12,1174,1,-
366,"amazing person know very well make laugh before",2009-09-10 21:51:32,1174,1,-
366,"carrot capitalism",2009-08-30 22:12:44,1174,1,-
366,"cold sad",2009-09-16 17:51:17,1174,1,-
366,"pain sad",2009-08-19 22:45:39,1174,1,-
366,"take many becomes very boring out",2009-09-12 21:54:28,1174,1,-
366,"thinking even though out better next week worth going already one ticket boat party smile",2009-09-22 17:46:14,1174,1,-
366,"really lovely time today smile",2009-09-17 23:35:50,1174,1,-
366,"god much stuff",2009-09-19 20:37:31,1174,1,-
366,"sad",2009-09-18 21:05:45,1174,1,-
366,"one week left go oh god roast dinner",2009-09-13 18:58:19,1174,1,-
366,"bye bye reading",2009-09-20 08:11:02,1174,1,-
366,"less month until shall leaving",2009-08-21 11:45:25,1174,1,-
366,"sat new room wondering laugh",2009-09-20 19:19:46,1174,1,-
