375,"sometimes wave people know very dangerous wave someone know laugh think cocky look thing useful gon na go pick something up",2010-02-12 00:05:35,806,1,-
375,"ca love yourself laugh gon na love anyone paul",2010-01-31 03:42:06,806,1,-
375,"angry care playful",2010-02-11 22:10:00,806,1,-
375,"screaming zombie god love angry music laugh",2010-01-17 20:11:47,806,1,-
375,"done cleaning kitchen away week playful",2010-02-13 18:56:45,806,1,-
375,"now know go lady luck dance laugh",2010-01-25 01:01:50,806,1,-
375,"ah",2010-02-13 22:22:47,806,1,-
375,"totally relaxed right now smile",2010-02-13 20:24:17,806,1,-
375,"ah laugh received saying best damnii getting complimentary walk hunger mug prove laugh",2010-02-13 19:00:58,806,1,-
375,"gay even katy totally relate song smile",2010-01-17 19:47:53,806,1,-
375,"trying find good laugh style tomorrow laugh",2010-01-31 23:07:11,806,1,-
375,"mine swear d",2010-01-25 02:21:50,806,1,-
375,"ca wait until tonight laugh",2010-02-15 19:47:54,806,1,-
375,"eating spicy rice laugh",2009-10-14 20:19:27,806,1,-
375,"today really boring anyone boy-friend girl-friend really day",2010-02-14 20:43:29,806,1,-
375,"one more trip down lost found find broken laugh smile",2009-10-29 21:20:03,806,1,-
375,"omelet laugh",2010-01-30 17:47:14,806,1,-
375,"sick e playful telling food bad food meant eaten anyone try stop eating file murder",2010-02-13 22:28:06,806,1,-
375,"oh god going smash face jelly laugh",2010-01-25 01:45:09,806,1,-
375,"stubborn people",2009-10-25 21:45:01,806,1,-
375,"waste time already voice inside laugh",2009-10-17 21:17:35,806,1,-
375,"chocolate delicious laugh",2010-02-15 19:40:40,806,1,-
375,"birthday days laugh",2009-11-02 01:34:49,806,1,-
375,"felt pretty today first fat goes talking short yeah totally laugh",2010-02-17 04:47:58,806,1,-
375,"gon na die stuffy nose",2009-10-30 02:28:57,806,1,-
375,"goddam cat broke dad favorite glass damnii",2009-11-02 00:00:50,806,1,-
375,"think pringle original intention make tennis day rubber supposed show up truckload potatoes came pringle company cut em up",2010-02-11 23:42:16,806,1,-
375,"living dog way stay sane",2010-02-26 23:47:40,806,1,-
375,"time ready dance laugh",2009-10-30 22:04:05,806,1,-
375,"tired good way feel wicked good right now smile",2010-02-26 22:10:37,806,1,-
375,"sexy wink",2010-02-26 21:53:12,806,1,-
375,"miss colon give native american history stop making english class history oppression american indian interested crap take course college thanks",2010-02-28 02:29:18,806,1,-
375,"needs someone talk playful",2010-02-14 21:21:05,806,1,-
375,"sir bleeding d",2010-03-05 02:19:22,806,1,-
375,"plan big fish tank fill goldfish name goldfish name one silver goldfish laugh",2010-02-11 23:12:17,806,1,-
375,"green day love smile",2010-03-05 03:05:01,806,1,-
375,"college fair later smile",2009-11-14 15:41:16,806,1,-
375,"much enough wake up living nightmare",2010-03-10 01:58:02,806,1,-
375,"laugh right now playful",2010-03-11 00:49:10,806,1,-
375,"finally story perfect ending x",2010-03-12 02:05:34,806,1,-
375,"please please last earth boat dark surrounded mechanical singing d",2010-03-12 00:29:07,806,1,-
375,"done miss colon five more politely shove down throat",2010-02-28 05:00:10,806,1,-
375,"laughing out loud study laugh",2010-02-27 01:12:23,806,1,-
375,"oh god feel sick dog",2010-03-15 01:59:35,806,1,-
375,"listening worn cover kidnap laugh",2010-03-18 21:12:43,806,1,-
375,"need ice cream hug laugh",2009-12-23 20:15:52,806,1,-
375,"gotten project concept completely finished laugh actually start laugh stuff playful",2010-01-06 01:59:43,806,1,-
375,"",2010-01-09 22:35:54,806,1,-
375,"getting over",2010-01-06 22:32:51,806,1,-
375,"coming swarm",2010-01-14 21:00:14,806,1,-
375,"know congress dude constantly really ca take want leave alone even dare try both know mean",2010-01-17 17:14:32,806,1,-
375,"egyptian superficially approachable another level very alien western",2010-01-10 02:17:37,806,1,-
375,"ready wester first tomorrow oh",2010-01-25 02:38:17,806,1,-
375,"laugh",2010-02-11 22:29:09,806,1,-
375,"smile",2010-02-13 01:17:37,806,1,-
375,"miss",2010-02-15 22:42:18,806,1,-
375,"death row given one last meal ask fortune cootie come long prosperous life",2010-02-07 00:45:10,806,1,-
375,"laugh make smile go extra mile make someone feel better really chitty day",2011-02-19 00:18:44,806,1,-
375,"love soul silver smile",2011-02-20 01:33:24,806,1,-
375,"day song favorite band difficult choose laugh watch",2011-02-25 16:52:06,806,1,-
375,"know casebook seriously acting up today",2011-02-25 16:52:49,806,1,-
375,"destroy poke war laugh",2011-02-26 09:22:10,806,1,-
375,"times miss old shop really",2011-02-27 10:05:35,806,1,-
375,"walking around everywhere lately getting know area moving better kind joyful",2011-03-05 00:41:53,806,1,-
375,"dodd dodd dodo voodoo bowling soup wink",2011-03-07 22:03:59,806,1,-
375,"wink",2011-03-10 20:19:03,806,1,-
375,"make plan right ca run around wan na build life want make plan day far away young want",2011-03-10 20:59:20,806,1,-
375,"status status",2011-03-16 00:45:29,806,1,-
375,"tired today long day",2011-03-16 23:17:39,806,1,-
375,"world ending zombie apocalypse first top five people list team brazen burlington",2011-03-16 23:19:43,806,1,-
375,"tired good thing friday sleep tomorrow smile",2011-03-18 14:59:59,806,1,-
375,"fry back job really need",2011-03-20 03:49:19,806,1,-
375,"turtle",2011-03-21 23:52:46,806,1,-
375,"",2011-03-24 03:53:17,806,1,-
375,"computer cell phone intend hot bike ball bat basketball eat mother made eat dealt think telling dare talk back big trouble life laugh life repost appreciate way raised",2011-04-01 22:28:25,806,1,-
375,"bargh girl day out wink",2011-04-02 16:56:09,806,1,-
375,"stayed up til morning carpenter admittedly stupid move both crap tired",2010-07-10 14:56:30,806,1,-
375,"those damn stole orange",2010-04-03 01:57:22,806,1,-
375,"possibly working ice cream stand summer smile",2010-04-03 03:19:46,806,1,-
375,"nap time laugh love",2010-10-08 21:02:14,806,1,-
375,"status post something wall repost status up challenge",2010-06-03 13:52:26,806,1,-
375,"ninja lima bean laugh",2010-07-30 23:34:21,806,1,-
375,"laugh people really",2010-04-03 20:03:26,806,1,-
375,"reject reality substitute smile",2010-07-31 19:26:41,806,1,-
375,"laugh guess",2010-07-14 19:16:20,806,1,-
375,"much stuff ta done stress stress stress laugh",2010-08-26 21:09:39,806,1,-
375,"",2010-04-30 23:56:23,806,1,-
375,"om gammick smile",2010-08-28 18:53:09,806,1,-
375,"need green day really bad right now ah",2010-06-20 23:46:19,806,1,-
375,"ah laugh laugh laugh sleeping tonight laugh",2010-06-22 01:10:05,806,1,-
375,"gon na watch zombie right now yeah wink",2010-07-18 17:58:38,806,1,-
375,"class mind d design few laugh",2010-09-21 13:03:01,806,1,-
375,"stomach yelling saying feed now eat",2010-08-29 22:33:48,806,1,-
375,"laughing out loud happy smile",2010-08-30 20:58:31,806,1,-
375,"dinner mind laugh",2010-10-17 20:33:44,806,1,-
375,"love mr new stuff laugh",2010-10-19 00:33:20,806,1,-
375,"going bed very soon sleep making laugh hurt bitch need stuff done sleep go",2010-09-23 16:02:21,806,1,-
375,"racoon",2010-06-11 19:31:14,806,1,-
375,"finally see wonderland today ink people made such big deal gutta great awful playful",2010-03-28 21:01:11,806,1,-
375,"laugh gon na frecken e playful lode ah",2010-05-18 19:10:51,806,1,-
375,"dance really badly look odd middle",2010-11-23 14:15:39,806,1,-
375,"laugh senior done think well lynn hit laugh comic book done playful",2010-05-04 21:58:45,806,1,-
375,"na na na na na na na na na na na na na na na laugh leave",2010-10-21 21:31:54,806,1,-
375,"officially moving california january disnew college program apparently extremely difficult choose california over florida still considered falltime student internship through college laugh",2010-11-10 18:16:21,806,1,-
375,"people honest now laugh tagged zoo photo funny laugh laugh",2010-04-03 02:59:08,806,1,-
375,"french laugh",2010-04-03 18:58:44,806,1,-
375,"smash mouth one amazing band make instantly laugh laugh",2010-04-04 02:28:16,806,1,-
375,"getting alienage lawton graduation gift very sexy wink",2010-04-17 17:59:29,806,1,-
375,"really over tired feel gon na cry idea",2010-08-16 04:05:08,806,1,-
375,"laugh anyone dollar footling song without lyric awesome love laugh",2010-04-08 01:28:48,806,1,-
375,"oh year old",2010-05-13 23:22:20,806,1,-
375,"love drawing class already wish more permanent ride though",2010-09-10 00:19:24,806,1,-
375,"back new bedford summerless really fun holy crap hurt",2010-07-05 03:11:40,806,1,-
375,"afternoon awake",2010-08-02 15:11:03,806,1,-
375,"sleeping laugh",2010-08-02 21:58:53,806,1,-
375,"play really good last night everyone go definitely try see laugh",2010-04-10 16:15:30,806,1,-
375,"miss",2011-02-07 12:05:12,806,1,-
375,"tired very stupid watching grudge erg",2010-11-02 19:15:20,806,1,-
375,"suggest wearing job gon na stand straight",2010-09-14 20:24:42,806,1,-
375,"oh work watching origin laughing out loud laugh",2010-03-28 23:53:49,806,1,-
375,"attention carpenter need guitar player video interested laugh please contact one soon thanks laugh",2010-04-13 19:51:01,806,1,-
375,"fake real real fake one choose",2010-08-24 05:05:42,806,1,-
375,"fun day tomorrow laugh",2011-02-03 06:54:05,806,1,-
375,"ca sarcastic people through text same",2010-10-09 07:54:21,806,1,-
375,"sad more reason one",2010-05-10 19:13:38,806,1,-
375,"time save world later smile",2010-05-10 22:49:36,806,1,-
375,"decided absolutely love ima robot laugh",2010-04-16 20:03:44,806,1,-
375,"laugh those still awake shop current bring movie case people forgot playful",2010-03-29 02:23:05,806,1,-
375,"going mad boredom",2010-04-18 16:06:27,806,1,-
375,"brawl raw laugh",2010-03-21 19:08:49,806,1,-
375,"being right fact love smile",2010-07-14 16:23:30,806,1,-
375,"really love give crap laugh",2010-03-21 15:22:29,806,1,-
375,"never better d wink",2010-08-31 03:28:57,806,1,-
375,"raw smile",2010-06-10 00:19:45,806,1,-
375,"",2010-10-17 00:38:43,806,1,-
375,"totally worth wink",2010-06-10 15:45:04,806,1,-
375,"people suck laugh over never stand being front general warning gon na nothing anyone never more serious life",2010-07-18 03:28:28,806,1,-
375,"laughing out loud today good day smile",2010-07-06 22:09:39,806,1,-
375,"toy store laugh",2010-06-24 21:40:31,806,1,-
375,"gon na take silver shadow believer spock rocker dirty gon na move gon na up ego silly boy gon na make cry wink",2010-04-16 19:25:41,806,1,-
375,"craving chocolate wicked bad",2010-04-23 21:29:46,806,1,-
375,"laugh",2010-04-24 02:08:36,806,1,-
375,"begging big moon playful fob few",2010-09-03 22:15:48,806,1,-
375,"pew pew laugh",2010-08-19 08:28:02,806,1,-
375,"look fire laugh",2010-04-18 20:41:55,806,1,-
375,"bath",2010-07-22 00:10:30,806,1,-
375,"sigh much such short amount time",2010-11-18 14:00:49,806,1,-
375,"wink",2010-06-15 21:17:19,806,1,-
375,"fruit salad yummy yummy laugh",2010-03-27 16:38:17,806,1,-
375,"dropping application kumbi laugh hurrah hopefully hire nice laughing out loud",2010-09-29 19:30:20,806,1,-
375,"want talk more empty laugh animal wiper part general direction mother laugh father smelt",2010-05-10 23:14:43,806,1,-
375,"yeah yeah laugh saying loud clear tell again give",2010-04-28 00:11:26,806,1,-
375,"over wink",2010-06-30 23:11:09,806,1,-
375,"suppose sleep mind racing ca rid",2010-08-23 05:43:27,806,1,-
375,"little brother addicted video cute trying kill enemy smile",2010-04-20 16:53:49,806,1,-
375,"now teething",2010-03-29 01:51:09,806,1,-
375,"think finally found apartment checked out met lady location cheap laugh",2010-08-23 23:25:41,806,1,-
375,"radio board education",2010-06-19 14:41:59,806,1,-
375,"mother beaten oar laugh",2010-07-03 20:24:35,806,1,-
375,"make soft beautiful starting riot",2010-07-03 16:03:03,806,1,-
375,"laugh many nightmare lately wonder mean",2010-07-03 13:17:46,806,1,-
375,"laugh senior playful",2010-04-30 19:29:01,806,1,-
375,"laugh",2010-11-23 16:27:01,806,1,-
375,"gutta work early ca go class ai ride home ca talk tonight today mixed bag d",2010-12-09 21:32:50,806,1,-
375,"nothing more stand watch someone try tear down ta love drama laugh",2010-05-02 02:32:37,806,1,-
375,"watching oblong funny know someone really look mean true laugh",2010-07-03 20:22:12,806,1,-
375,"galagala passing fun laugh",2010-07-05 23:15:03,806,1,-
375,"much needs done making lot tomorrow",2010-08-27 05:12:39,806,1,-
375,"current picture love came out thanks finally up playful",2010-03-28 21:54:26,806,1,-
375,"holy crap sad now wan na cry",2010-07-19 22:52:12,806,1,-
375,"bother bother bother bother bother bother bother bother bother bother bother bother bother bother bother bother bother bother bother bother bother bother bother bother bother bother bother bother bother bother bother bother bother bother bother bother",2010-11-22 15:45:50,806,1,-
375,"ok amarelle fire alarm went very know fuck going laughing out loud everything gon na alright now wink",2010-06-24 15:56:07,806,1,-
375,"know watched much anime combine together",2010-04-03 15:28:02,806,1,-
375,"give next skip go straight graduation seriously playful",2010-04-12 19:13:18,806,1,-
375,"know those days purposely talk yourself people room see ask laugh talking think insane one those days smile",2010-04-20 02:13:59,806,1,-
375,"wan na know damn well mean wan na know people listen d",2010-07-30 21:31:11,806,1,-
375,"breaking out right now",2010-09-18 02:15:05,806,1,-
375,"complete senior project laugh",2010-04-19 23:01:30,806,1,-
375,"finally permit laugh",2010-04-23 20:06:12,806,1,-
375,"meo",2010-09-02 23:36:00,806,1,-
375,"laugh right now",2010-05-03 01:07:14,806,1,-
375,"needs laugh pay laugh sad",2010-08-05 19:59:06,806,1,-
375,"laugh champion",2010-05-22 20:51:35,806,1,-
375,"oh day much better laugh",2010-05-10 19:57:37,806,1,-
375,"brownie go go baby wink",2010-05-12 02:01:11,806,1,-
375,"oh god love piano violin right now such pretty smile",2010-05-12 02:11:31,806,1,-
375,"ah scream pelt",2010-12-05 18:29:45,806,1,-
375,"laugh world survive ketchup matter good",2010-04-28 21:34:33,806,1,-
375,"long day hostility laugh rolled one going bed before turn zombie tomorrow",2010-04-13 03:10:22,806,1,-
375,"murphy murphy darling long now night gayyou pain pleasure sorrow joy feel now lost laugh good cheer laugh",2010-07-19 20:29:27,806,1,-
375,"love classes actually excited draw again laugh",2010-09-10 18:30:37,806,1,-
375,"spent ridiculous amount time solitaire life people wow shame",2010-11-09 21:29:01,806,1,-
375,"talking laugh strange playful",2010-07-18 21:42:17,806,1,-
375,"people talk gon na cry boredom",2010-06-08 22:52:43,806,1,-
375,"oh god death cute",2010-08-02 04:12:55,806,1,-
375,"good smile",2010-07-05 22:54:13,806,1,-
375,"awesome yes smile",2010-06-22 02:33:13,806,1,-
375,"pizza amazing laugh",2010-08-14 19:49:53,806,1,-
375,"mesh need out someone soon shall die serious",2010-09-29 22:49:36,806,1,-
375,"feel damn bad right now think gon na go paint later",2010-08-06 22:15:22,806,1,-
375,"tired miss certain people really badly right now",2010-08-06 21:42:58,806,1,-
375,"stupid cat realize six bigger getting underfoot windup killing poor thing",2010-04-13 02:05:56,806,1,-
375,"looking good laugh stylist actually cut laugh smile",2010-08-07 23:02:45,806,1,-
375,"laugh need guy interested becoming interested talk carpenter tomorrow thanks smile",2010-04-28 01:43:59,806,1,-
375,"laugh piece computer go die hole",2010-08-19 05:24:16,806,1,-
375,"whole damn day myself anyone wan na out",2010-04-18 14:20:02,806,1,-
375,"ah laugh laugh laugh laugh baking next couple potluck supper tomorrow smile",2010-05-11 22:25:47,806,1,-
375,"exhausted time school work homework talk between screw going bed early tonight english tomorrow morning",2010-09-16 20:12:15,806,1,-
375,"going disnew meeting new bought ticket stuff gon na great smile",2010-12-14 17:34:13,806,1,-
375,"yeshiva",2010-05-22 14:33:30,806,1,-
375,"bean ninja few oh god love game much smile",2010-08-19 00:04:38,806,1,-
375,"best laugh laugh",2010-06-28 23:37:16,806,1,-
375,"driven tonight laugh still feel bit woozy bloodworm ugh",2010-07-15 21:31:23,806,1,-
375,"burrito oh love love smile",2010-08-19 17:22:26,806,1,-
375,"interview upon",2010-06-28 17:47:10,806,1,-
375,"miss even know",2010-08-20 03:04:59,806,1,-
375,"arch",2010-11-18 21:09:21,806,1,-
375,"society accept cry cry cry",2010-07-17 14:19:29,806,1,-
375,"oh god back day laughing out loud laugh",2010-05-10 19:31:34,806,1,-
375,"yelp yelp yelp smile",2010-05-16 16:37:51,806,1,-
375,"lovely day best one smile",2010-05-18 02:39:39,806,1,-
375,"laugh",2010-05-27 20:01:06,806,1,-
375,"shiny new refund debt card shiny laugh",2010-09-26 19:42:09,806,1,-
375,"confused right now",2010-04-23 22:46:12,806,1,-
375,"need until wish",2010-10-12 19:16:11,806,1,-
375,"ink many times again care",2010-05-15 19:35:30,806,1,-
375,"love screw over sweetheart wink",2010-08-30 05:25:58,806,1,-
375,"much cake good thing playful ugh",2010-06-27 22:25:08,806,1,-
375,"done idiot surround smile",2010-05-17 01:35:15,806,1,-
375,"singing theme song morning wicked loudly felt bad ass awesome story right smile",2010-06-04 15:48:02,806,1,-
375,"still school laughing out loud playful",2010-06-06 02:28:25,806,1,-
375,"love weird laugh",2010-05-02 01:38:30,806,1,-
375,"galagala tired",2010-07-01 03:03:31,806,1,-
375,"ta love fact high school over laugh",2010-05-01 17:58:56,806,1,-
375,"very",2010-08-15 05:01:33,806,1,-
375,"love psi controller laugh",2010-05-15 21:38:01,806,1,-
375,"shiite mean send people goddam spasm",2010-05-22 17:31:18,806,1,-
375,"one day skeleton knew coming",2010-05-22 19:00:41,806,1,-
375,"laughing out loud wut laugh",2010-07-03 23:12:56,806,1,-
375,"",2010-05-15 20:28:31,806,1,-
375,"feel bad poor people saw one cigarette richard made night last night waterie laughing out loud laugh",2010-08-02 03:58:24,806,1,-
375,"pretty awesome laugh ca wait til friday",2010-10-10 23:14:24,806,1,-
375,"galagala love life wink",2010-06-10 18:08:34,806,1,-
375,"pancake date rape laugh",2010-06-03 15:29:49,806,1,-
375,"know actually being laugh day even though time meet interesting people campus smile",2010-09-07 20:26:40,806,1,-
375,"guess jury duty",2010-06-04 01:03:20,806,1,-
375,"week think everyone needs chill out stuff worth fighting over seriously",2010-05-17 21:40:46,806,1,-
375,"new weight loss goal wan na user work order lose ton weight damn straight laugh",2010-05-09 00:23:13,806,1,-
375,"one time ink well interview interview interviewer ask surprise",2010-06-28 20:54:56,806,1,-
375,"interesting people very nice",2010-06-30 01:45:20,806,1,-
375,"sea punk invasion love wink",2010-08-08 00:11:58,806,1,-
375,"plain sokeman night being worth wink",2010-05-30 00:48:59,806,1,-
375,"surprise gon na kill",2010-06-18 18:37:23,806,1,-
375,"marge treat mother ugh beat shovel",2010-06-10 21:55:08,806,1,-
375,"going bed great weekend seeing hopefully again laugh",2010-10-18 01:55:10,806,1,-
375,"",2010-11-02 22:39:20,806,1,-
375,"please please world make sense morning",2010-06-12 02:35:10,806,1,-
375,"very silly mood playful",2010-07-03 18:09:46,806,1,-
375,"seriously gon na go wrong god gon na drop goddam sky great laugh",2010-06-20 23:31:46,806,1,-
375,"going play laugh g u again game never old laughing out loud smile",2010-05-16 23:47:28,806,1,-
375,"now bad neck hurt crack",2010-05-16 21:23:14,806,1,-
375,"man food oh god love richmond laugh",2010-08-14 00:53:02,806,1,-
375,"drunken wink",2010-06-12 16:23:46,806,1,-
375,"out sugar oh god miss",2010-08-16 00:54:09,806,1,-
375,"mah birthday tomorrow probably wo go until next tuesday going back taunton weekend see old mine wink",2010-11-04 19:49:04,806,1,-
375,"laugh lot",2010-07-18 23:31:34,806,1,-
375,"laughing out loud laugh",2010-06-25 17:55:00,806,1,-
375,"interview monday smile",2010-06-27 02:11:56,806,1,-
375,"laugh",2010-12-02 14:09:56,806,1,-
375,"tran up",2010-06-16 19:26:11,806,1,-
375,"laughing out loud laugh",2010-05-18 00:37:49,806,1,-
375,"craving real food bad right now eating nothing amen tuna fish j now sick",2010-09-26 00:40:33,806,1,-
375,"tired full graduation party ugh dead playful",2010-06-06 01:41:30,806,1,-
375,"admirable ship",2010-06-27 04:17:52,806,1,-
375,"want go laugh house right now feel laugh sight",2010-10-28 20:27:10,806,1,-
375,"yesterday much fun even though everything go wrong laugh",2010-05-22 13:34:50,806,1,-
375,"mew smile",2010-08-06 19:26:55,806,1,-
375,"know think laugh night right before go bed windup laugh thinking yeah cool",2010-06-12 14:56:01,806,1,-
375,"batman raw smile",2010-06-11 18:53:22,806,1,-
375,"job finally laugh",2010-06-09 22:24:07,806,1,-
375,"cough",2010-06-19 00:04:17,806,1,-
375,"summer laugh ah",2010-06-25 20:19:42,806,1,-
375,"mere laugh",2010-07-06 03:28:12,806,1,-
375,"meter dangerously close red",2010-07-07 19:18:52,806,1,-
375,"sleep",2010-10-03 08:42:10,806,1,-
375,"arch damn canada smoke kill laugh",2010-06-01 00:47:46,806,1,-
375,"status tell dislike confession brave post status see people",2010-07-10 15:27:14,806,1,-
375,"fo yo silly laugh",2010-06-28 22:59:03,806,1,-
375,"morning grandma win d pink",2010-08-15 17:52:14,806,1,-
375,"love laugh school smile",2010-06-03 18:05:57,806,1,-
375,"feel woozy laughing out loud both arms laugh",2010-07-13 16:23:10,806,1,-
375,"please mind wan na think",2010-07-03 21:28:57,806,1,-
375,"music staple food love",2010-06-02 18:04:33,806,1,-
375,"once gon na care conveniently look away think want fall die believe never see doing keep smiling till door behind",2010-07-14 01:13:44,806,1,-
375,"wow unconscious keeping em laugh",2010-07-03 23:58:38,806,1,-
375,"still carpenter house laughing out loud out jangly gentle later good day smile",2010-07-11 18:16:36,806,1,-
375,"laughing out loud love evolution laugh",2010-06-25 03:59:01,806,1,-
375,"ca room mine d stuff crazy psi anime more punching bag everything work want need cry cry cry",2010-08-10 22:52:39,806,1,-
375,"kitten fluffy cute smile",2010-06-23 01:15:19,806,1,-
375,"love smile",2010-06-04 01:12:55,806,1,-
375,"laughing out loud love make feel laugh x",2010-07-14 02:33:29,806,1,-
375,"kitten fluffiness tail seen surprise",2010-08-11 01:58:19,806,1,-
375,"besides being hungry time today really good day laugh",2010-10-13 00:18:54,806,1,-
375,"oh god many love love smile",2010-07-31 19:00:33,806,1,-
375,"kind depressed right now",2010-06-04 20:56:38,806,1,-
375,"miss best much ca wait til wednesday thursday laugh",2010-08-22 02:17:10,806,1,-
375,"smile",2010-06-10 00:55:01,806,1,-
375,"listening flyleaf cassie",2010-07-07 21:53:50,806,1,-
375,"tired barely sleep last night ugh feel awful upside little beday party turned last saturday smile",2010-07-17 13:45:44,806,1,-
375,"tired",2010-12-28 20:22:20,806,1,-
375,"going see green day carpenter august laugh",2010-06-24 23:11:29,806,1,-
375,"oh yeah snow awful ca even oh wait california snow laugh laughing out loud",2011-01-13 06:49:09,806,1,-
375,"bath",2010-10-14 21:45:27,806,1,-
375,"d prediction stuff computer exactly right knew",2010-07-20 00:17:00,806,1,-
375,"oh god type energy right now idea rid ah",2010-07-23 20:52:41,806,1,-
375,"good mood destroy laugh",2010-06-22 14:19:48,806,1,-
375,"pew pew laugh",2010-07-23 18:34:44,806,1,-
375,"laugh out today point probably later sooner ah",2010-07-08 12:57:23,806,1,-
375,"happy fluffer red blanket laugh",2010-08-28 01:02:04,806,1,-
375,"love tattoo laughing out loud laugh",2010-07-07 21:17:19,806,1,-
375,"smile",2010-12-07 22:07:41,806,1,-
375,"thunder laugh",2010-07-24 20:09:40,806,1,-
375,"shopping store laugh",2010-07-06 18:25:28,806,1,-
375,"open past present future giving up",2010-08-19 22:02:30,806,1,-
375,"beastie love",2010-07-14 03:08:50,806,1,-
375,"floor",2010-09-30 21:12:07,806,1,-
375,"yes laugh",2010-08-21 03:05:47,806,1,-
375,"calcium need yo yo silly wink",2010-07-28 01:29:25,806,1,-
375,"both arms gon na fall now k thanks bam",2010-07-13 19:01:23,806,1,-
375,"sleeping late older still glad o mine laugh",2010-07-22 20:29:18,806,1,-
375,"now working getting third fun times",2010-09-27 00:42:38,806,1,-
375,"sexy time over laughing out loud wink",2010-07-07 16:21:46,806,1,-
375,"listening epic music various laugh stuff work listening video game music defense very pretty piano caustic music",2010-06-22 01:55:29,806,1,-
375,"job wendy laugh",2010-08-02 20:38:55,806,1,-
375,"dude hot",2010-06-24 17:42:28,806,1,-
375,"oh green day song everything smile",2010-07-14 00:47:16,806,1,-
375,"shout laugh",2010-07-19 21:00:50,806,1,-
375,"watching house marathon time laughing out loud smile",2010-08-21 00:02:52,806,1,-
375,"wow call baby nerve prank call house dumbness know voice god people stupid playful",2010-07-19 01:58:50,806,1,-
375,"erg people",2010-07-19 03:12:42,806,1,-
375,"toy store laugh",2010-07-15 22:50:36,806,1,-
375,"laugh laugh",2010-07-30 02:04:11,806,1,-
375,"hi music add down today",2010-07-01 21:50:18,806,1,-
375,"job one wink",2010-07-01 20:20:27,806,1,-
375,"sleeping wife muffin wink",2010-07-22 23:32:04,806,1,-
375,"teens middle aged cry saw partisan twilight standing top skyscraper jump one sit eating popcorn screaming flip sparkly bitch copy paste status",2010-07-20 00:10:19,806,1,-
375,"sleep yesterday afternoon same class took complete even enough time drawing due tonight d such pain ass",2010-10-05 20:00:31,806,1,-
375,"drawing class hour wonder show up time laugh",2010-09-09 22:22:40,806,1,-
375,"laugh snow",2010-12-21 16:00:02,806,1,-
375,"cry seriously",2010-08-05 21:33:18,806,1,-
375,"green day amazing last night out very end best night life thanks guess ta rise against kind pay back comes anywhere close wink",2010-08-18 03:10:32,806,1,-
375,"tired constantly two days laugh",2011-01-21 06:15:04,806,1,-
375,"guess gon na gone week starting monday way wo back til following sunday gon na onset next beach laughing out loud call text cell wan na talk laugh",2010-08-08 00:37:55,806,1,-
