166,"alright next question mythology challenge up under",2011-01-16 23:11:35,239,0,-
166,"quick someone ask moderately algebra question see understand junk last word one crossed mind",2010-10-25 20:37:44,239,0,-
166,"laugh being old",2010-10-19 17:00:36,239,0,-
166,"thanksgiving forget tell everyone love thankful being life",2010-11-22 23:08:43,239,0,-
166,"more important dancing more important jersey shore more important soap opera more important sports team know life story those people dang well read little people making country",2010-11-02 11:43:23,239,0,-
166,"laugh hint challenge middle east good luck separate note",2011-01-28 01:44:07,239,0,-
166,"seriously need stop up",2010-10-28 08:20:19,239,0,-
166,"more days till see favorite short person",2010-10-05 03:59:58,239,0,-
166,"ok figured out polynomial pretty much now linear two variable",2010-10-26 20:14:38,239,0,-
166,"tables turned finally learned making up day gone concerned now confirmed spread learned fly alone",2011-01-24 01:35:31,239,0,-
166,"ta work tomorrow saturday oh fun week laugh",2010-11-11 22:06:54,239,0,-
166,"few people understand one shotted boss ice up lich attempt far killing everyone long laugh slayer title tonight",2010-11-17 08:03:45,239,0,-
166,"morning good morning",2010-11-22 22:50:14,239,0,-
166,"furniture today oh joy",2010-10-17 18:15:08,239,0,-
166,"home thanksgiving pretty good time people see nice day today",2010-11-26 01:51:49,239,0,-
166,"again comes early tomorrow",2010-11-13 02:00:18,239,0,-
166,"never count yesterday past exist never give myself away reason resist melt away miss outside snow falling cold come calling",2011-01-07 03:32:05,239,0,-
166,"night everyone good",2011-01-08 02:22:27,239,0,-
166,"before start next challenge laugh recap mythological research skill point total millions laugh zach humphrey age finally",2011-01-17 04:23:53,239,0,-
166,"one even tried guess current challenge good job time",2011-01-22 01:42:05,239,0,-
166,"name person first correct awesomeness",2011-01-16 19:51:00,239,0,-
166,"text program working again think",2010-12-09 04:43:49,239,0,-
166,"cootie smile smile cootie smile smile mine smile smile smile smile waffle smile smile trade",2010-11-22 01:19:46,239,0,-
166,"come take drink drown gone til marrow everyone go listen bestorm pirate metal awesome",2010-11-10 02:25:30,239,0,-
166,"new challenge up send top two unbox",2011-01-17 16:23:15,239,0,-
166,"tired sleep",2010-11-04 22:51:23,239,0,-
166,"worse test score made test oh humanity",2010-11-11 18:22:48,239,0,-
166,"one sided relationship going laugh sing show love return cold ache",2011-01-08 03:16:05,239,0,-
166,"algebra test tomorrow ok cause zach going go take",2010-11-11 03:10:04,239,0,-
166,"colder water buffalo winter up laugh",2010-11-07 03:08:49,239,0,-
166,"night little snow",2011-01-12 05:45:56,239,0,-
166,"still waiting correct identification drawing awesomeness winner purchase offer valid illegal sent unbox",2011-01-14 18:18:48,239,0,-
166,"back house dixie now going go laugh allow coma take affect",2010-11-28 23:20:04,239,0,-
166,"skittle ment sweet tart ai riddle need id card illegal give kind little take laugh please",2010-12-03 00:31:49,239,0,-
166,"still new challenge one thursday give another hint lower again p s",2011-01-30 03:05:50,239,0,-
166,"tired",2010-11-13 18:49:45,239,0,-
166,"ok laugh new mythology trivia challenge going put up picture morning people day answer two end day give out new system works first correct answer second third each one",2011-01-17 16:16:31,239,0,-
166,"sitting school wait til class start",2011-01-18 14:04:05,239,0,-
166,"still correct answer current mythology identification picture one guess close hurry claim awesomeness guess sent unbox multiple",2011-01-15 15:47:05,239,0,-
166,"dream day white dance around house town store without laugh",2011-01-24 02:01:46,239,0,-
166,"new question up days until more people figure out good luck intelligent little",2011-01-16 20:08:17,239,0,-
166,"sitting front much longer walk house",2010-11-08 21:44:28,239,0,-
166,"good morning trust everyone wonderful night sure each great day",2011-02-10 13:43:06,239,0,-
166,"new mythology challenge up work",2011-02-06 19:29:14,239,0,-
166,"zach second person answer current question grass one more go",2011-01-16 22:33:49,239,0,-
166,"laugh new year hope everyone better year year last year",2010-01-01 07:30:35,239,0,-
166,"zach being first name mythical question awesomeness",2011-01-16 19:10:28,239,0,-
166,"last find answer challenge log tomorrow",2011-02-06 03:48:38,239,0,-
166,"thankful family love anyway thankful made over amongst people walk earth thankful time spent angel trapped frail body thankful even though body mind strong",2010-11-23 00:23:14,239,0,-
166,"laugh find rated goddess",2011-01-17 02:23:29,239,0,-
166,"ok hint time hint fire dude sword norse god human nice use laugh figure out",2011-01-17 02:29:16,239,0,-
166,"",2011-01-31 00:08:57,239,0,-
166,"well homework school short report test sadly question test",2011-01-13 04:03:39,239,0,-
166,"those brains working",2011-01-17 04:45:06,239,0,-
166,"one meant tough manage keep one answer before smile give hint lower prize awesomeness case anyone wondering zach humphrey age tied laugh millions",2011-01-16 23:49:17,239,0,-
166,"maybe super laugh x challenge shake up around smile tonight anyone top keep question open until correct first answer worth whooping second answer worth third answer worth forth answer worth",2011-01-19 17:13:40,239,0,-
166,"love",2011-01-15 18:04:51,239,0,-
166,"people place live laugh pizza",2011-01-27 14:06:31,239,0,-
166,"zach third winner grass",2011-01-17 05:48:06,239,0,-
166,"good night casebook keep those coming",2011-01-18 01:23:19,239,0,-
166,"laugh correct answer challenge telling anyone cause want anyone getting answer wink",2011-01-23 04:41:44,239,0,-
166,"several throughout world sunday nothing normally feel such strong empathy search",2011-02-15 18:25:54,239,0,-
166,"reason text program working",2010-12-09 02:19:01,239,0,-
166,"make bad person shot people right think safe under cover hit people laugh foot long ax foot width",2010-12-19 20:22:45,239,0,-
166,"prepared people tomorrow night challenge laugh waving day rule picture active until laugh times normal amount",2011-01-19 01:52:27,239,0,-
166,"k answer challenge mars aphrodite",2011-01-19 01:23:48,239,0,-
166,"lot homework",2011-01-25 23:38:33,239,0,-
166,"bid thee safe along",2011-01-26 03:40:04,239,0,-
166,"everyone ready next question",2011-01-16 19:44:05,239,0,-
166,"algebra",2011-01-25 01:44:11,239,0,-
166,"ah study today",2011-01-13 20:14:01,239,0,-
166,"school tomorrow provided close snow",2011-01-09 23:55:02,239,0,-
166,"ah love pain free mornings",2010-12-16 15:38:02,239,0,-
166,"done first day college year break ah truly school",2011-01-18 22:10:09,239,0,-
166,"one more think people think",2011-01-16 20:54:46,239,0,-
166,"won second set",2011-01-16 19:18:28,239,0,-
166,"gotten second answer question hint come third person",2011-01-17 02:37:19,239,0,-
166,"ok sitting window mountain clubhouse always lady around window more red tend nervous around movement orange tend more curious",2011-02-07 20:02:25,239,0,-
166,"thinking go doctor soon days long little closer spine",2011-01-30 22:32:39,239,0,-
166,"",2011-02-11 01:46:50,239,0,-
166,"nights row hope before tomorrow cant laugh hour work days sleep",2011-01-30 13:11:15,239,0,-
166,"yeah lot reading",2011-01-05 19:29:16,239,0,-
166,"laugh hot enough burn alive inside living life laugh enough take everything away",2011-02-11 08:20:45,239,0,-
166,"anatomy physiology test today nearly math plus made feel much better today still math test out ice general population",2011-02-08 23:50:02,239,0,-
166,"ready next question people laugh one",2011-01-16 23:10:00,239,0,-
166,"congress second answer trivia question correctly",2011-01-16 20:54:12,239,0,-
166,"one more answer challenge over next one start morning",2011-01-17 05:21:54,239,0,-
166,"ok last one first second grass good work now laugh one insert evil laugh",2011-01-20 02:51:19,239,0,-
166,"still need correct before moving next question",2011-01-16 21:56:22,239,0,-
166,"done test waiting everyone finish",2011-01-20 15:54:08,239,0,-
166,"bogtrot yankee uniform november uniform november tango november tango hotel papa yankee november papa tango tango yankee uniform tango tango uniform",2011-01-17 01:09:33,239,0,-
166,"anyone know something really bad laugh yesterday around smile",2011-02-14 14:26:01,239,0,-
166,"ok one answer mythology challenge before thursday gon na give everyone hint give hint correct reduced thats still second place case wondering",2011-01-24 16:14:06,239,0,-
166,"holy cow again first answer new question grass again lord",2011-01-16 21:11:09,239,0,-
166,"new even last nights hint disappointing p s",2011-01-28 23:03:56,239,0,-
166,"next challenge up fun",2011-02-07 01:46:17,239,0,-
162,"understand purpose poke option determined win",2011-02-21 07:36:39,1,0,-
156,"time fire up life living",2009-09-08 01:11:19,330,0,-
156,"undo la te laugh presto en apricot es lo se debt laugh",2009-09-21 03:43:00,330,0,-
156,"es lo en se debt de laugh lo el dicta o lo la razor te dice",2009-09-15 01:26:42,330,0,-
156,"es moment de uprender las favor quell lieve luceres",2009-11-26 02:35:15,330,0,-
156,"enter la de la mete y la",2009-01-03 09:45:07,330,0,-
156,"laugh en las de y en la de mi mete",2010-01-05 05:11:47,330,0,-
156,"mess pomerium en musca de moment de",2010-01-07 22:01:44,330,0,-
156,"de vulva undo inferno sin",2010-01-16 04:39:44,330,0,-
156,"favor las mejorana si es en vera alien suede aurar lo necessity",2010-01-23 07:02:52,330,0,-
156,"getting ready fun escapade spirit river mess",2010-01-09 15:05:31,330,0,-
156,"want reconcile violence laugh want beauty mask want exorcise demon past want satisfy undisclosed laugh gracious soft la tan genial",2010-01-23 21:13:12,330,0,-
156,"know think",2010-01-30 03:42:18,330,0,-
156,"life truly special ways show need f n l f n t s y know alone",2010-02-03 02:18:03,330,0,-
156,"back routine",2010-02-02 02:02:50,330,0,-
156,"o o weirdness meaning",2010-02-17 03:33:40,330,0,-
156,"shall dance",2010-02-14 02:39:53,330,0,-
156,"become one ourselves",2010-02-15 05:32:39,330,0,-
156,"those understood death sacrifice beginning new journey become true laugh embrace",2010-03-03 03:57:04,330,0,-
156,"erase school forever teenage angst",2010-03-02 03:11:17,330,0,-
156,"skies above love",2010-03-01 02:56:33,330,0,-
156,"sorrow t h e b u r d e n e d",2010-03-15 16:11:53,330,0,-
156,"t h e b u r d e n e d",2010-03-06 19:02:41,330,0,-
156,"answer call desperate shelter fall earthly temper flame furnace bear toward purpose",2010-01-21 04:29:42,330,0,-
156,"truly decided want give life laugh even essence process",2010-06-01 05:08:00,330,0,-
156,"leave behind leave out rest linking park",2010-10-07 03:15:59,330,0,-
156,"t h e b u r d e n e d now laugh",2010-03-19 02:07:10,330,0,-
156,"screwed unknown excuse please",2011-01-15 22:28:34,330,0,-
156,"swore show damn hurt lost someone care someone right thing right thing bring someone end up misery pain",2010-05-25 04:03:15,330,0,-
156,"man guilty doing good done decision infamous",2010-07-14 19:14:19,330,0,-
156,"t h e b u r d e n e d laugh laugh fair soldier st class f n l f n t s y",2010-03-25 04:36:29,330,0,-
156,"somewhere down road lost myself time",2011-01-21 03:27:00,330,0,-
156,"t h e b u r d e n e d f n l f n t s y",2010-03-20 06:26:38,330,0,-
156,"wondering face under skin really wishing see lost weak",2010-04-10 19:07:25,330,0,-
156,"status excited subject try new wax set diagnosis nineteenth century mode",2011-01-23 22:37:42,330,0,-
156,"crew alumnus n ca santo con de de ser teacher es love",2010-06-28 03:55:27,330,0,-
156,"wo give up wo break down sooner life turns around",2010-11-10 03:35:50,330,0,-
156,"dream cry sully altar",2010-11-09 02:18:27,330,0,-
156,"demon await mighty run mighty run globous",2010-07-28 18:00:52,330,0,-
156,"taking edge taking",2010-11-17 04:04:29,330,0,-
156,"screw send burn fiery pit really want",2010-04-11 00:31:48,330,0,-
156,"thesis fed up",2010-08-06 16:07:09,330,0,-
156,"portunidae per lo estate contemplant much come lo laugh en mi elinor ambroid",2010-11-04 03:38:08,330,0,-
156,"derby awesome string braid january want",2010-07-12 00:30:23,330,0,-
156,"face inside right beneath skin",2010-04-11 03:36:10,330,0,-
156,"tired first weekend christmas break hit bead early ask basilica know",2010-12-13 00:37:31,330,0,-
156,"supposed everything suddenly",2010-04-05 02:37:20,330,0,-
156,"wishing life easier feeling nostalgic once life",2010-05-04 05:36:38,330,0,-
156,"long quite time elias lost vast endlessness mind sure",2010-11-27 20:50:39,330,0,-
156,"crew alumnus n ca santo con de de ser teacher es",2010-06-28 03:41:25,330,0,-
156,"lived one best afternoons year mrs farewell thank much scarf laugh",2010-12-18 04:54:46,330,0,-
156,"terrar fluent parus parus cor duces stellar recent love",2010-05-08 19:48:22,330,0,-
156,"richard based way awesome singer voice terrible",2010-04-10 00:31:21,330,0,-
156,"pay taken warding world potter serious",2010-04-20 02:56:05,330,0,-
156,"totally love brightly sky against darkness night love lone",2010-04-30 03:16:17,330,0,-
156,"tu bija come lo quintant room",2010-09-10 03:40:48,330,0,-
156,"derby finally",2010-07-16 18:35:41,330,0,-
156,"pear de simple brusque para",2010-03-29 04:36:18,330,0,-
156,"totally completely absolutely excited grafting laugh come",2010-10-29 23:15:36,330,0,-
156,"thank showing those times need never go thank showing stand up believe thank being guide those times need thank being thank being yourself f n l f t s y fair",2010-04-11 23:44:02,330,0,-
156,"long time last read book day now remember love reading much love",2010-04-21 01:23:38,330,0,-
156,"human nature one complex learn one easiest lose w",2011-01-06 06:37:33,330,0,-
156,"die faltche doom derby fighting adhaka hope such aroma blizzard forage water",2010-06-07 03:20:10,330,0,-
156,"status vigilance subject mind restless even whole body begging rest diagnosis unknown",2011-01-09 09:02:31,330,0,-
156,"quiet luganda dragon age awakening pseudo vital en see judge",2010-04-27 20:06:14,330,0,-
156,"kyrie divine lesion love",2010-05-15 19:35:18,330,0,-
156,"goddess life cover silvery light laugh overcome challenge face today victorious day guide through day",2010-10-22 11:46:02,330,0,-
156,"want many life always restrict one",2010-05-04 04:38:41,330,0,-
156,"now more still think final fantasy one theb game peaceful slumber vanille love",2010-06-14 02:58:40,330,0,-
156,"muse love",2010-04-29 03:39:02,330,0,-
156,"more laugh",2010-05-22 23:20:30,330,0,-
156,"one one straighten wrong one laugh someday someday w inspired dragon age out",2010-06-17 17:59:11,330,0,-
156,"y hora se supine laugh",2010-05-25 00:22:01,330,0,-
156,"liberia diem account tanquam love",2010-05-25 02:52:27,330,0,-
156,"es la definitive es la produce inquietude",2011-01-25 04:37:34,330,0,-
156,"whether want right thing w classmate",2010-06-12 03:58:29,330,0,-
156,"lift up go burn inside thousand laugh father catalyst linking park",2010-08-26 04:16:24,330,0,-
156,"punto de empire el concerto de",2010-10-17 01:21:44,330,0,-
156,"status subject due several start two status severe obsession disorder",2011-01-14 00:50:41,330,0,-
156,"es different per la es usual justo come laugh dos hora tunca el final",2010-06-02 04:32:33,330,0,-
156,"desex de passado solo laugh side mal",2010-04-26 20:04:48,330,0,-
156,"de de mi regress scenario",2010-10-18 02:16:45,330,0,-
156,"past laugh passado drive aller y lieu pour moi",2010-05-04 06:20:04,330,0,-
156,"lost game",2010-12-30 03:35:45,330,0,-
156,"fin mi atlas de crew con y",2010-10-21 01:31:13,330,0,-
156,"elias thesis lame chen",2010-08-13 18:50:18,330,0,-
156,"thus sur moi chest chest player",2010-06-10 03:29:58,330,0,-
156,"pour tu tore chose parle completement different",2010-12-07 03:29:59,330,0,-
156,"bloody laugh arm surprise derby yerba final fantasy",2010-06-09 02:47:29,330,0,-
156,"animal sacrifice cur grein laugh cur venial petrous terrar fatal love",2010-05-08 00:41:42,330,0,-
156,"status lazy subject homework ripe work seriously going throw everything out window diagnosis extreme laziness",2011-02-05 22:57:39,330,0,-
156,"keep beat up loud make feel rush adrenaline pump music out dance out way feel love",2010-06-13 05:06:06,330,0,-
156,"people life through glasses fantasy",2010-05-25 03:23:04,330,0,-
156,"wo murder time running out time running out amuse",2010-06-05 20:02:26,330,0,-
156,"en mi rosillo y es pseudo basilar tut",2010-06-15 23:23:29,330,0,-
156,"note perpetual love",2010-05-27 03:24:35,330,0,-
156,"wow read home bad dream ago creeper out",2010-05-27 02:02:53,330,0,-
156,"human nature one complex learn one easiest lose w december",2010-06-02 04:43:48,330,0,-
156,"unique para el case laugh laugh en chino las positron gorilla el amor de laugh",2011-01-08 00:38:01,330,0,-
156,"asiento e playful locanda en vera son linos per ya laugh te en mess tal te distaste de semang",2010-06-21 22:37:53,330,0,-
156,"note perpetual laugh vision par dram video te mane e playful love final fantasy versus somnus",2010-06-23 00:00:39,330,0,-
156,"loveless tale goddess loveless tale two loveless tale sky loveless",2010-07-06 20:45:00,330,0,-
156,"one now forever triumph w inspired one dark fantasy version dragon age out",2010-06-22 03:19:54,330,0,-
156,"wow e playful action dream inception",2011-01-22 02:39:15,330,0,-
156,"turn even fate stand way doorba fang final fantasy peaceful slumber both",2010-06-15 01:17:16,330,0,-
156,"laugh hold",2010-06-05 02:15:34,330,0,-
156,"wow e playful limbo inception",2011-01-22 02:28:53,330,0,-
156,"good soldier choosing waka waka time",2010-06-28 05:53:36,330,0,-
156,"ultimo de ultimo en se",2010-06-28 12:04:44,330,0,-
156,"once more cleanse surface want tell something rain language love",2010-06-13 07:34:14,330,0,-
156,"second time try direct first time try shape fitness sentence offing amazing laugh",2010-11-15 03:45:12,330,0,-
156,"whole world against vanille final fantasy",2010-06-09 04:01:32,330,0,-
156,"holy crap face derby talking final fantasy",2010-06-06 04:19:31,330,0,-
156,"hora el self guardable",2010-08-02 01:14:56,330,0,-
156,"maybe make maybe d fall short long before make someone someday know d tried vanille thinking battle yerba final fantasy",2010-06-10 01:34:44,330,0,-
156,"pus yo cuesta lo cuesta",2010-06-16 02:53:06,330,0,-
156,"such radiance coming lady suddenly turned wolf smoky dream",2010-11-22 12:48:05,330,0,-
156,"truly decided want give life laugh even return essence process",2010-06-01 02:48:50,330,0,-
156,"feeling good smile",2010-08-06 18:03:14,330,0,-
156,"whole world against yerba vanille final fantasy",2010-07-17 03:35:57,330,0,-
156,"feeling weird odd sarcastic apologize beforehand inconvenience",2011-01-06 21:14:07,330,0,-
156,"goddess te trouvere tu rest sur sur la lune oh goddess tu es raiment loveless",2010-07-16 02:43:34,330,0,-
156,"today hieron completement individable desex lo major m en nevo y lo aspirin ser se laugh n ca olden cretan condign para lo felix cavidae todus y desex",2010-12-25 01:12:17,330,0,-
156,"cur venial petrous terrar fatal beg forgiveness fateful land busaos en la destiny final fantasy advent land",2010-06-09 04:21:07,330,0,-
156,"status exhausted subject body more energy causing immense wish sleep diagnosis unknown",2011-01-11 15:50:20,330,0,-
156,"wolf d run away house keep searching lady mind dream",2010-10-19 00:57:48,330,0,-
156,"laugh day oh day",2011-02-14 12:35:27,330,0,-
156,"alright missing etymologic laugh lab report history project laugh e playful position someone shoot please",2010-11-29 00:47:04,330,0,-
156,"pour tu laugh tout finis porto mon",2010-07-25 20:20:56,330,0,-
156,"banish",2010-07-04 05:21:18,330,0,-
156,"oh goddess loveless",2010-10-05 04:16:22,330,0,-
156,"lasting tunca percheron per denaro de mi sent todus lo dig",2010-06-27 20:23:58,330,0,-
156,"gaia those small hit blindingly speed hurting oh gaia done",2010-08-11 21:47:50,330,0,-
156,"need blur between reality creation imagination mrs farewell meeting power wisdom",2010-07-03 22:55:10,330,0,-
156,"thousand coming out september",2010-07-09 03:27:09,330,0,-
156,"flash mob anywhere laugh",2011-01-22 21:04:10,330,0,-
156,"war victory peace vigilance death sacrifice warden join ultimate sacrifice",2010-06-17 02:41:32,330,0,-
156,"surrounded nature beautiful wonder",2010-11-02 00:00:01,330,0,-
156,"normal love rain oh goddess forgive lone soft meditation bliss",2010-07-10 01:30:37,330,0,-
156,"ide de humanist extreme nature era war victory peace vigilance death sacrifice warden oath",2010-08-31 03:51:24,330,0,-
156,"soy fan per hoy train cuesta la verse y train en el simple mexican amos amos ganam come en las batatas de",2010-06-27 18:13:55,330,0,-
156,"stop wake night ca laugh psychological thriller anyone",2010-07-15 01:07:06,330,0,-
156,"mas undo las sale mal para confriar en vale la pen",2010-06-27 19:50:14,330,0,-
156,"oh goddess lost benevolence forgotten goddess loveless",2010-08-23 03:46:48,330,0,-
156,"found once more motivation rock world",2011-01-14 06:45:59,330,0,-
156,"new new day new life feeling good smile",2010-08-02 18:25:26,330,0,-
156,"hope remains laugh dream",2010-12-11 11:41:49,330,0,-
156,"amen ah men free faith found amen saraband suite eternal globous",2010-07-26 17:17:21,330,0,-
156,"cento come o go per per fin y cab adore join h",2011-01-07 01:19:16,330,0,-
156,"come come down earth precious gift skies pour down salvation cleanse world corruption laugh oh goddess loveless",2010-07-09 07:35:17,330,0,-
156,"thesis one more",2010-08-12 01:57:16,330,0,-
156,"status subject mind blown away such impressive graphics cable together psi diagnosis unknown",2011-01-10 02:20:24,330,0,-
156,"thinking choreography epic music really love",2010-07-14 16:46:14,330,0,-
156,"believe nous language want meaning same believe",2010-01-01 07:29:28,330,0,-
156,"vila carbon gabi ale garo belly black tungan todus excelente inigo de semester y se de reburden la es reg o cigar para power sign de la mandra en la hieron n isotron y n ca dude de amos lo simple se",2010-08-16 04:06:12,330,0,-
156,"christian de la ochna percha re cardona tungan todus excelente inigo de semester y se de reburden la es reg o cigar para power sign de la mandra en la hieron n isotron y n ca dude de amos lo simple se",2010-08-16 04:05:47,330,0,-
156,"india de lo major amos amos lo el tempo side corrigenda amos si se suede",2010-08-17 01:50:34,330,0,-
156,"probang probang dos dos train terrible con sus trauma canada capitan de de la pes te",2011-01-08 00:41:31,330,0,-
156,"pantas gracious bago",2010-08-10 16:44:28,330,0,-
156,"wisdom justice love blinking park",2010-09-15 04:57:38,330,0,-
156,"derby officially gleek one",2010-11-30 03:59:37,330,0,-
156,"cur venial petrous terrar fatal final fantasy",2010-07-24 03:15:22,330,0,-
156,"mau fez termino la tarea de",2010-08-21 21:35:35,330,0,-
156,"omina divided tragedial coram amandus note perpetual laugh vision par dram video te mane e playful somnus final fantasy versus",2010-11-04 02:36:13,330,0,-
156,"human strength human laugh human nothing",2010-10-29 02:23:51,330,0,-
156,"en caza la trade boche terminant mi tarea de la coal laugh con gusto y de much sore bacteria y up definitely need chen",2010-08-22 04:41:15,330,0,-
156,"status subject ca imagine life new music discovered diagnosis unknown",2011-01-12 03:01:00,330,0,-
156,"writing ca properly",2010-08-29 01:43:42,330,0,-
156,"poco poco vice see humor negro tuno tan quell de la laugh tu voluntary y sterno e w",2010-11-04 03:57:21,330,0,-
156,"oh limpin con tu suave el mal de undo protege mogadore de la boche floran tu laurencia diota eternal",2010-08-24 04:00:37,330,0,-
156,"elias manito bastard per elias torque yo quiet vera briton briton genial testudo",2010-12-03 00:09:45,330,0,-
156,"plug baby crucified tired giving amuse plug baby",2010-09-24 03:03:06,330,0,-
156,"start over again good time right last forgive ourselves muse erogenesis symphony redemption",2010-09-28 01:01:12,330,0,-
156,"ami elihu lope laugh ochna cruise rosillo tungan todus excelente inigo de semester y se de reburden la es reg o cigar para power sign de la mandra en la hieron y n ca dude de amos lo simple se",2010-08-16 04:05:00,330,0,-
156,"kubera la de studia adore el latin love",2010-09-03 04:59:46,330,0,-
156,"de invade corrode hoga",2010-09-03 18:53:39,330,0,-
156,"elias thesis great chen",2010-08-16 04:07:03,330,0,-
156,"listening erogenesis symphony definitely one best laugh",2010-09-23 03:06:33,330,0,-
156,"people die yuma yuma stop dancing day decided never see yuma dancing again nidus final fantasy x",2010-10-10 03:33:12,330,0,-
156,"n ca antes laugh centimo tan felix y tan en de primer lo se sent la sequela con gusto",2010-08-20 02:27:25,330,0,-
156,"loving each moment life love",2010-09-22 00:31:43,330,0,-
156,"love",2010-09-24 02:51:03,330,0,-
156,"third book done status stasis",2011-01-08 02:11:14,330,0,-
156,"en el concerto de",2010-10-17 22:57:05,330,0,-
156,"status worried subject mind clouded nephew sudden conclusion subject seem care right now life diagnosis unknown",2011-01-12 02:47:32,330,0,-
156,"amigo y conopidae y en familiar y laugh yo sin much gracious en la laugh en vera se preoccupant el otto helices fiesta",2010-12-25 01:12:22,330,0,-
156,"quemado todus es lo mal con todus laugh de m sin tender es area de la naturalize",2010-08-31 00:35:08,330,0,-
156,"those people watching eclipse right now thank moment watching god bless",2010-12-21 07:42:28,330,0,-
156,"status sleepy due legal identification subject enough sleep diagnosis exhaustion",2011-01-14 16:13:24,330,0,-
156,"ya case es el concerto de alkes system felix felix",2010-10-22 23:28:13,330,0,-
156,"flow water worry take",2010-10-04 02:03:13,330,0,-
