158,"memorize macbeth soliloquy check macbeth essay check still list recall documentary stopboard computer science take home test study vocal study telei test",2010-01-18 19:06:26,1361,1,-
158,"mad relic blasphemy tell",2010-01-11 23:46:01,1361,1,-
158,"ca sing very well laugh laugh",2010-01-06 23:12:26,1361,1,-
158,"recall check utrecht torture word next up come si take home test",2010-01-18 22:20:26,1361,1,-
158,"want d now",2010-01-19 12:15:04,1361,1,-
158,"work",2009-09-03 19:31:46,1361,1,-
158,"misterm suck much point honestly making cappy mood even worse",2010-01-22 11:47:25,1361,1,-
158,"now laugh laugh times straight laugh times living ai easy stand up against whatever fall call",2010-01-21 12:04:36,1361,1,-
158,"breaking cold pool room ah well",2010-01-12 23:14:54,1361,1,-
158,"bad mood gone woke up morning back cause feel royally state think play cheer up little",2010-01-23 17:50:19,1361,1,-
158,"still bad mood butt practice think going bit solo bit scales sight read two laugh",2010-01-23 01:09:05,1361,1,-
158,"tradition tonight party sleeping over laugh",2009-12-31 22:31:06,1361,1,-
158,"think driving tonight confidential",2009-08-30 00:33:50,1361,1,-
158,"miss miss being laugh",2010-01-22 01:22:01,1361,1,-
158,"angel oliver past party best out four swim",2010-01-21 03:18:11,1361,1,-
158,"sleep hornet go",2009-12-29 03:17:46,1361,1,-
158,"rehearsal concerto competition going band banquet supper late laugh",2010-01-15 22:42:43,1361,1,-
158,"nice phone hinge broke entirely time go horizon store",2010-01-09 17:35:18,1361,1,-
158,"sleep school swim finally getting varsity letter beat smile",2010-01-19 02:57:45,1361,1,-
158,"new phone free now pay insurance",2010-01-09 20:20:17,1361,1,-
158,"sorry",2010-01-24 04:24:48,1361,1,-
158,"school swim meet r p smile",2010-01-05 12:06:41,1361,1,-
158,"see lipide gram smile recall come si day",2010-01-25 19:56:02,1361,1,-
158,"everything banquet laughing out loud more region wind ensemble tomorrow laugh",2010-01-16 03:27:39,1361,1,-
158,"stuck trying figure out title pilot concept spoof band kids",2009-09-28 23:29:10,1361,1,-
158,"today going slowly think manning text laugh",2010-01-08 17:45:31,1361,1,-
158,"man freshman before even freshman again",2009-08-31 02:29:43,1361,1,-
158,"fallen dipsey go kick butt smile",2010-01-24 19:15:34,1361,1,-
158,"ca wait til season again need income again",2010-01-10 17:14:34,1361,1,-
158,"swim go laugh",2010-01-12 17:47:28,1361,1,-
158,"play flute cousin wedding love",2009-12-26 03:31:36,1361,1,-
158,"microvolt piano lab swim",2010-01-27 12:23:16,1361,1,-
158,"well next time see laugh laugh gone byee smile",2010-01-30 18:10:14,1361,1,-
158,"open house homework ugh homework back again tut",2009-01-03 19:00:14,1361,1,-
158,"finally better smile shoot american idol totally forgot one night actually free watch gash",2010-01-27 02:09:07,1361,1,-
158,"cut laugh short today getting laugh done feel needs go",2010-01-30 17:58:46,1361,1,-
158,"watching august rush fall more love love",2010-01-28 23:41:28,1361,1,-
158,"audition saturday love ca wait fellah",2010-02-01 22:01:34,1361,1,-
158,"feel car day four day weekend yes",2010-01-27 21:58:11,1361,1,-
158,"accepted western illinois university yes",2010-02-01 22:52:50,1361,1,-
158,"repertoire list laundry shower jazz fest long day text love fellah",2010-01-29 15:37:16,1361,1,-
158,"notebook family love",2010-01-29 01:33:02,1361,1,-
158,"good mood still thursday wake up early tomorrow region wind ensemble day laugh rehearsal accompanist concerto competition going band banquet late breaking awesome love",2010-01-14 17:38:39,1361,1,-
158,"allocate tomorrow love ca wait see fallen dipsey fellah",2010-02-03 13:52:05,1361,1,-
158,"region concert please come high school please come",2010-01-17 14:59:29,1361,1,-
158,"ask something fellah",2010-02-01 02:16:12,1361,1,-
158,"school swim good mood smile",2010-01-12 12:05:15,1361,1,-
158,"love laugh seeing lovely mother mrs love fellah",2010-01-30 23:22:19,1361,1,-
158,"stop posting ca make anyone laugh",2010-01-31 04:18:40,1361,1,-
158,"lovely creedist movie watching something laugh mother before go bed nightmare love fellah",2010-01-31 02:55:06,1361,1,-
158,"engaged joke seriously",2010-01-19 02:23:27,1361,1,-
158,"duet choir church today flute lesson know text",2010-01-31 15:32:43,1361,1,-
158,"thursday goes away d love skip friday ca wait plane love fellah",2010-02-04 03:11:45,1361,1,-
158,"love week misterm far homework now much less recall today love fellah",2010-02-02 21:55:55,1361,1,-
158,"think go watch pride prejudice love love fellah",2010-02-01 22:02:49,1361,1,-
158,"holy crap laugh casebook seriously need stop time anyway airport smile",2010-02-05 13:55:24,1361,1,-
158,"terrible day number two up number three tut",2010-01-21 23:36:01,1361,1,-
158,"great job even told one start season nice way tut state tonight good thing today",2010-02-04 19:48:00,1361,1,-
158,"someone send something red ribbon spoiled gifted",2009-10-12 23:45:40,1361,1,-
158,"week go slow know saturday love fellah",2010-02-02 02:29:22,1361,1,-
158,"wish laugh look cut love fellah",2010-02-03 21:58:46,1361,1,-
158,"hold falling apart hold both fall down fall tell everything want forever forever same wonder long god awful mood last laugh",2010-01-22 01:49:50,1361,1,-
158,"everyone picture caleb booklike look",2010-02-08 22:25:55,1361,1,-
158,"well unload win later computer acting stupid school picture printer",2010-02-08 14:08:07,1361,1,-
158,"prediction today absolutely correct thee buckish day senior year far",2010-01-21 02:56:08,1361,1,-
158,"day love",2009-09-28 12:41:13,1361,1,-
158,"illinois love ca wait go back school idea hopefully looking picture soon make memo board win trip bring school next love",2010-02-08 13:26:23,1361,1,-
158,"region wind ensemble smile",2010-01-16 12:56:02,1361,1,-
158,"awkward hour life scoliosis s back bad",2010-01-16 23:00:45,1361,1,-
158,"school band go love",2009-10-06 10:51:57,1361,1,-
158,"over immature people over high school ca wait college over decide going already look forward college forget high school best four life ass definitely",2010-02-03 03:16:53,1361,1,-
158,"ugh wo unload weekend until dad home reset computer wo unload",2010-02-08 20:04:56,1361,1,-
158,"sleep love school again tomorrow band practice lech",2009-10-08 01:57:49,1361,1,-
158,"laugh short smile posting now fellah",2010-01-30 20:39:53,1361,1,-
158,"wish something snow days",2010-02-11 16:34:48,1361,1,-
158,"seven long fellah",2010-02-11 17:51:59,1361,1,-
158,"illinois fellah",2010-02-10 22:14:35,1361,1,-
158,"convinced never go figuratively course",2010-01-19 23:31:38,1361,1,-
158,"ca possibly endure nine days fix anything",2010-01-25 01:11:36,1361,1,-
158,"love possibly wait recording bath incredibly long day homework tomorrow joy",2010-01-17 23:22:28,1361,1,-
158,"happy figure skating laugh fellah",2010-02-15 00:34:43,1361,1,-
158,"reading night threw wall one put father body furnace awful",2009-10-23 00:17:09,1361,1,-
158,"flute lesson trying finish repertoire list filling out scholarship folding laundry much love fellah funny everyone now",2010-01-31 18:44:55,1361,1,-
158,"yeah really ca wait out laugh fellah",2010-02-14 16:27:57,1361,1,-
158,"feel lot better today wo taking gross pain again stick morin",2009-11-04 14:44:14,1361,1,-
158,"finishing up ithaca stuff fellah",2010-02-14 23:36:54,1361,1,-
158,"greek sleep school go fellah",2010-02-16 03:27:12,1361,1,-
158,"finally done college record laugh common stupid never sleep english misterm gram funeral study party come si later",2010-01-25 02:53:37,1361,1,-
158,"gash laugh",2009-10-16 00:06:42,1361,1,-
158,"two left filling out million scholarship fellah",2010-02-14 13:48:08,1361,1,-
158,"school filling play rehearsal weekend",2010-02-17 03:42:08,1361,1,-
158,"back school tomorrow unfortunately western love fellah",2010-02-15 02:19:08,1361,1,-
158,"play more tomorrow through saturday concert saturday nepal come watch please",2010-02-17 22:16:13,1361,1,-
158,"anyone know time jazz fest love fellah",2010-01-29 18:39:46,1361,1,-
158,"wish people actually mature seriously site make fun people",2010-02-03 03:01:11,1361,1,-
158,"days days days love school love fellah",2010-02-01 12:14:48,1361,1,-
158,"sleeping over microvolt piano lab misterm tomorrow",2010-01-27 03:54:23,1361,1,-
158,"making up schedule work making christmas list possibly finally getting around room know",2009-11-14 20:06:42,1361,1,-
158,"ca keep doing done",2009-10-28 10:43:06,1361,1,-
158,"music motion smile ca wait see hillman fallen dipsey again",2009-10-11 14:46:38,1361,1,-
158,"gramme sleep school cycle again thursday leaving illinois friday laugh",2010-02-01 01:59:27,1361,1,-
158,"today fun morin stopped working ice crying jaw bad",2009-11-06 03:12:03,1361,1,-
158,"weekend bubble back saturday evening fellah",2010-02-18 03:24:34,1361,1,-
158,"well hone course laugh laugh good always end way quickly symphonic band love",2010-02-21 02:00:26,1361,1,-
158,"band football game flute competition rehearsal smile",2009-10-24 13:40:03,1361,1,-
158,"want go back school tomorrow laugh",2010-02-15 00:09:48,1361,1,-
158,"cold school stuff go love fellah",2010-02-02 12:14:53,1361,1,-
158,"love new shirt lot smile fellah",2010-02-14 18:24:40,1361,1,-
158,"freezing love fellah",2010-01-31 22:59:53,1361,1,-
158,"oh even going school tomorrow laugh know laugh illinois tomorrow breaking excited hopefully sleep smile",2010-02-05 02:53:32,1361,1,-
158,"well mostly good day ca wait ca come quick enough",2010-01-31 04:24:48,1361,1,-
158,"school play repeat fellah",2010-02-24 12:08:38,1361,1,-
158,"new wonderful made even more team fan",2009-11-21 20:14:49,1361,1,-
158,"",2009-11-02 01:42:02,1361,1,-
158,"go see new again",2009-11-28 13:25:26,1361,1,-
158,"home home home ithaca really really nice music building crazy insane definitely snowy though",2010-02-28 02:48:33,1361,1,-
158,"snow stop family shower ithaca fellah",2010-02-26 14:26:15,1361,1,-
158,"ca wait face yeah nice fellah",2010-02-16 03:26:28,1361,1,-
158,"work later",2009-11-12 20:11:16,1361,1,-
158,"school play meeting",2009-11-10 11:51:32,1361,1,-
158,"sleep possibly school hopefully driving up ithaca audition saturday fellah",2010-02-26 01:33:04,1361,1,-
158,"six great adventure favorite band bamboozle laugh favorite band five old love",2010-03-02 20:34:02,1361,1,-
158,"secret life make break greek fellah immature",2010-02-16 01:24:41,1361,1,-
158,"searching house retainer forever much",2010-03-03 20:39:28,1361,1,-
158,"laugh snow needs spring already fellah",2010-02-15 22:56:45,1361,1,-
158,"hotel party fallen dipsey laundry go smile fellah",2010-02-16 22:54:09,1361,1,-
158,"school vision board listening region d love",2010-03-05 12:23:31,1361,1,-
158,"jazz band school swim rehearsal going long day",2009-11-16 12:00:23,1361,1,-
158,"raw miss song laugh",2010-02-22 17:59:55,1361,1,-
158,"march need over need know scholarship make decision already bath",2010-02-11 14:30:42,1361,1,-
158,"wish something outside nice",2010-03-08 19:48:04,1361,1,-
158,"caprella past party later text",2009-12-14 23:50:40,1361,1,-
158,"well up bit still overcast whole lot yesterday smile",2010-03-14 15:07:40,1361,1,-
158,"school clue everything ended swim play",2010-03-10 12:21:53,1361,1,-
158,"beach house weekend love back sunday fellah",2010-03-12 23:18:53,1361,1,-
158,"pouring beach fellah",2010-03-13 17:42:15,1361,1,-
158,"finished first season laugh through second season now work",2010-03-11 23:16:00,1361,1,-
158,"laugh day until serious swim banquet montage way selling comb swimming documentary montage banquet know more once",2010-03-11 12:28:23,1361,1,-
158,"beach nothing",2010-03-14 00:55:36,1361,1,-
158,"select choir caroler banging",2009-12-19 00:07:14,1361,1,-
158,"went see wonderland mother fabulous fellah",2010-03-16 00:12:09,1361,1,-
158,"play pray smile bath totally screwed up day supposed go visit brother birthday college stupid dress rehearsal tut",2010-03-01 20:23:23,1361,1,-
158,"weather stay forever",2010-03-17 18:52:32,1361,1,-
158,"please snow region rehearsal need",2009-12-18 23:47:15,1361,1,-
158,"still know illness",2009-12-24 16:39:28,1361,1,-
158,"stupid poem project tut laugh smile",2010-03-18 19:39:28,1361,1,-
158,"flute lesson laugh man flute today know laugh",2010-02-28 19:25:50,1361,1,-
158,"mere want adobe premiere pro much easier much less time consuming home",2010-03-17 21:30:51,1361,1,-
158,"really money christmas much want buy",2009-12-24 04:05:19,1361,1,-
158,"sleep rehearsal tomorrow",2009-12-19 03:53:13,1361,1,-
158,"unconsciously put green morning really mean laugh",2010-03-17 11:18:41,1361,1,-
158,"kenno bombard work much english homework",2010-03-04 21:23:50,1361,1,-
158,"home beach five days til go back laugh fellah",2010-03-15 00:47:20,1361,1,-
158,"yes potter weekend",2010-03-16 00:19:55,1361,1,-
158,"clue write stupid concept paper kelek write idea idea laugh",2010-01-07 01:14:40,1361,1,-
158,"yeah think go unless someone sick people laugh",2010-03-09 17:26:41,1361,1,-
158,"meet epic fail best times care smile anyone know really good face posturize",2010-01-07 23:52:08,1361,1,-
158,"actually play something open mid tonight bout time hurrah flute soles accompaniment",2010-01-09 00:02:33,1361,1,-
158,"singing smile",2010-01-04 00:04:09,1361,1,-
158,"finally found way onto casebook school good real casebook something during lunch room now laugh",2010-01-04 17:56:10,1361,1,-
158,"debating whether perform senior soonish sort thing earthstar go see band world bamboozle",2010-03-16 20:20:10,1361,1,-
158,"starting really transcript",2010-01-09 04:17:36,1361,1,-
158,"now ca even laugh state screwed up badly",2010-01-24 14:42:24,1361,1,-
158,"done recall hopefully watching pride prejudice study party",2010-01-25 21:50:15,1361,1,-
158,"greatly amazing right now much misterm tomorrow tut",2010-01-24 21:40:21,1361,1,-
158,"decided two ago really watch august rush again miss think tonight tomorrow finally free day",2010-01-27 22:41:18,1361,1,-
158,"sure hope school goes fast today state tonight praying love fellah",2010-02-04 12:12:04,1361,1,-
158,"accepted smile",2010-01-28 20:51:05,1361,1,-
158,"english misterm gram funeral",2010-01-25 03:12:36,1361,1,-
158,"jazz fest fantastic legit ca wait state fallen dipsey smile love fellah",2010-01-30 04:48:28,1361,1,-
158,"oh god made state made state yes",2010-01-24 03:34:35,1361,1,-
158,"please plane already fellah",2010-02-04 20:06:45,1361,1,-
158,"yeah reunion fellah",2010-02-23 12:01:10,1361,1,-
158,"one time disnew parade going trying through crowd black woman stood way path through crowd excuse response little excuse still response very loud excuse turns around goes ghetto fabulous apparently laugh first time",2010-05-05 19:20:19,1361,1,-
158,"superheat rehearsal still two more days two more learn",2010-08-19 03:58:10,1361,1,-
158,"play solo new jersey symphony orchestra",2010-04-01 20:18:44,1361,1,-
158,"anyone know take picture computer screen",2010-05-08 18:34:10,1361,1,-
158,"laugh smile",2010-10-27 03:03:47,1361,1,-
158,"great mood walking back dorm breeze listening rally one love",2010-10-26 20:25:29,1361,1,-
158,"thank boo listening spill two straight best friend ask place far home love",2010-09-15 04:46:46,1361,1,-
158,"know much prefer way professor class way classes read lecture paper due end week instead bunch homework during week down dinner work smile smile fellah",2010-06-16 22:13:52,1361,1,-
158,"man monday tomorrow already fellah",2010-03-22 01:47:07,1361,1,-
158,"paper writing begin wish play rest floor instead",2010-09-17 00:19:00,1361,1,-
158,"houseroom getting cap gown working paper summer class fellah",2010-06-17 13:37:39,1361,1,-
158,"q guilty pleasure guess drama show family secret life make break greek name pretty embarrassing admit watch those",2010-11-17 03:49:01,1361,1,-
158,"think difficult stay chill feel",2010-08-26 03:27:22,1361,1,-
158,"probably worst day hopefully something better soon",2010-09-18 02:51:57,1361,1,-
158,"turns out go looking laugh costume everything need closet leopard dress plastic leopard yeah man",2010-10-30 02:00:59,1361,1,-
158,"stupid poem project time tomorrow hopefully getting come si review done before secret life fellah",2010-03-22 21:30:26,1361,1,-
158,"beginning love senior wonderful sunburned s p school work miglio birthday fellah",2010-05-27 02:38:46,1361,1,-
158,"first day stress management elective class smile",2010-06-07 19:15:24,1361,1,-
158,"laugh scoop college accepted music performance education western illinois university west still laugh ithaca bad made decision already smile",2010-03-26 21:42:39,1361,1,-
158,"church",2010-08-29 15:28:44,1361,1,-
158,"school mad laundry watch movie fellah",2010-03-26 11:24:36,1361,1,-
158,"laundry cleaning house summer class lecture more laundry more cleaning house party tonight laugh",2010-06-22 16:12:45,1361,1,-
158,"noah bower",2010-03-21 01:55:27,1361,1,-
158,"back disnew forcing go school today d fellah",2010-04-22 11:17:03,1361,1,-
158,"visit band camp today kids seem doing great job laugh smile third last day work",2010-08-09 22:21:44,1361,1,-
158,"wish age limit people bring know exactly d d",2010-04-11 18:16:50,1361,1,-
158,"scrolled mouse work desperately need laundry quarters grr movie time yes",2010-10-17 17:02:53,1361,1,-
158,"four two b c bad stupid come si keeping being honor roll flesh fellah",2010-04-23 18:52:14,1361,1,-
158,"mr holland opus movie magical bed",2010-11-07 01:33:51,1361,1,-
158,"quad flute festival day smile",2010-09-26 13:59:18,1361,1,-
158,"b come si final laugh text fellah",2010-06-14 16:29:16,1361,1,-
158,"forgot good laugh film mean mean book fantastic favorite mile movie really think give much credit need",2010-03-25 00:36:27,1361,1,-
158,"talk loverly durant today wish tag next week cuber busy nonsitting working laugh concert visiting crazy oh flute camp recital poco reunion going beach much long pray pray long wait wait long til see face see shining through",2010-07-24 17:48:37,1361,1,-
158,"everyone text driving smile",2010-08-16 11:07:47,1361,1,-
158,"love laugh much love new album school fellah",2010-06-08 02:47:21,1361,1,-
158,"actually think finally starting really appreciate movie first came out openly laugh left much out think good job kept",2010-03-22 01:20:23,1361,1,-
158,"woo more potter weekend order phoenix tonight laugh",2010-03-21 23:48:41,1361,1,-
158,"making college drying laugh go fellah lose music plug ipid computer",2010-04-06 21:08:47,1361,1,-
158,"time next week way home love",2010-11-14 19:10:34,1361,1,-
158,"watch potter movie kind sick watching same six time new one oh laugh new one coming out six days fuss",2010-11-12 21:41:28,1361,1,-
158,"beach gorgeous love tell phone longer send casebook stupid reason rehearsal competition laugh",2010-03-20 21:19:15,1361,1,-
158,"three days til potter six days til go home love",2010-11-15 17:08:59,1361,1,-
158,"lunch gon na rest profusely hopefully change out clothes fresh everyone now sweat four yeah fun stuff",2010-08-19 16:51:35,1361,1,-
158,"school up yeah pretty sure maybe making list college laugh making list people invite graduation party fellah",2010-03-25 11:29:50,1361,1,-
158,"writing stupid english essay work smile fellah",2010-03-25 20:00:31,1361,1,-
158,"according fleming potter problem everyone already knew playful",2010-10-05 02:44:29,1361,1,-
158,"practice open mid church temporizing stupid poem english making more college fellah",2010-04-06 17:34:42,1361,1,-
158,"realizing voice part davy jones voice caribbean going go check limb find out right",2010-11-19 17:55:13,1361,1,-
158,"band today miss love",2010-09-13 17:01:41,1361,1,-
158,"spring break out mind already step up tonight laugh fellah",2010-04-05 19:51:03,1361,1,-
158,"even though dashed bank myself before wo total bull sick being little needs mommy come laugh cash check tut fellah",2010-04-13 19:04:21,1361,1,-
158,"piano meadow display dinner go fellah days til college",2010-04-13 21:46:02,1361,1,-
158,"theory eye two english hour wind ensemble",2010-08-25 12:56:25,1361,1,-
158,"scholarship done st now onto anyone know one due date",2010-03-26 20:00:37,1361,1,-
158,"rain needs stop competition fellah",2010-03-28 16:28:53,1361,1,-
158,"morning til saturday smile fellah",2010-04-01 02:05:58,1361,1,-
158,"sure hope stop before cough crazy wicked",2010-05-10 01:55:46,1361,1,-
158,"alright much run more ten telling myself anything through christ keep breathing dummy going pass out",2010-07-12 17:35:52,1361,1,-
158,"another interesting day praise jesus friday",2010-08-27 02:16:16,1361,1,-
158,"party house tuesday know want come",2010-06-19 16:01:39,1361,1,-
158,"miss good used out more smile",2010-12-09 01:04:48,1361,1,-
158,"greater youth orchestra fun smile sleep church flute lesson rebroadcast walk love",2010-06-06 03:05:39,1361,1,-
158,"term paper day hopefully finish decent time cleaning room",2010-06-30 16:51:15,1361,1,-
158,"crap anyone know fix broken d drive",2010-11-07 01:47:22,1361,1,-
158,"human oval laugh watch mr holland opus laugh bed tomorrow fellah",2010-04-10 05:49:25,1361,1,-
158,"wish practice sick tut",2010-05-11 19:25:07,1361,1,-
158,"definitely time go see eclipse again laundry today cleaning up house bit hopefully going bank grad birthday going away sleeper tonight smile",2010-07-02 16:39:23,1361,1,-
158,"great day smile feel roundabout upturn smile fellah",2010-04-05 01:20:11,1361,1,-
158,"poco birthday wednesday forget back saturday smile",2010-07-04 02:45:33,1361,1,-
158,"awesome weekend went saw mall smile washington vienna wait really sweet being next huge statue really surrenal fellah",2010-04-03 13:16:00,1361,1,-
158,"wish kind party go today alum win leatherneck laugh",2010-06-21 22:25:05,1361,1,-
158,"high competition smile recital st fellah",2010-03-30 19:39:03,1361,1,-
158,"learning meadow new piano smile pretty fellah",2010-04-13 00:18:48,1361,1,-
158,"finally see precious sad last one",2010-04-05 02:54:32,1361,1,-
158,"tell favorite restaurant around laugh need go grad dinner tonight",2010-06-23 19:20:19,1361,1,-
158,"up rental caravan midst writing three final thank scholarship leave school tomorrow morning excitement unmatched laugh",2010-08-15 00:11:05,1361,1,-
158,"rice kristi simple make laugh clean up",2010-09-22 04:56:16,1361,1,-
158,"swimming ready anyone ordered one order one bring tomorrow order receive made up people ordered set want one know",2010-06-09 19:25:11,1361,1,-
158,"laugh greek sleep school filling go fellah",2010-03-23 01:54:39,1361,1,-
158,"yeah potter weekend laugh",2010-03-21 00:20:17,1361,1,-
158,"roomie fleming leaving night d hope ortho apt goes well though lush",2010-09-01 17:15:40,1361,1,-
158,"dewey win american idol youp",2010-04-01 01:18:26,1361,1,-
158,"three classes jury rehearsal four weekend smile",2010-12-03 14:35:28,1361,1,-
158,"parent sorry forgot tag before weber due glynn mass tell day school best meet",2010-05-27 01:51:34,1361,1,-
158,"nothing out smile want lifetime want whole world love",2010-07-17 18:14:45,1361,1,-
158,"man use bay account excited start retired beanie up sale guess wait make serious money until july tut",2010-04-07 22:18:12,1361,1,-
158,"fun day practiced service tomorrow finally broke out ice cream cake supposed birthday finally beat dad game laugh forever forever forever praise name",2010-07-18 02:02:19,1361,1,-
158,"nice quite nice now much tut",2010-05-16 23:46:36,1361,1,-
158,"perfection",2010-04-08 01:35:51,1361,1,-
158,"one best nights last night thanks garnett dagmar laugh smile love love",2010-12-11 15:03:14,1361,1,-
158,"last swim banquet over time more disnew laugh fellah",2010-04-24 16:46:11,1361,1,-
158,"suppose wish oddman laugh birthday watching respectable character laugh",2010-03-22 00:16:35,1361,1,-
158,"sectional woodbind sectional dinner back out onto field blah",2010-08-19 17:37:10,1361,1,-
158,"good spend time old open mid open mid smile fellah",2010-04-09 19:42:31,1361,1,-
158,"american idol first time watched season suck year fellah",2010-03-25 02:01:12,1361,1,-
158,"rehearsal kite runner sleep fellah",2010-04-25 20:50:53,1361,1,-
158,"grace ocean sinking laugh earth sloppy wet kiss laugh turns violently inside chest time maintain think way oh",2010-07-11 18:26:18,1361,1,-
158,"laugh casebook forced choose put section profile used",2010-05-09 03:08:59,1361,1,-
158,"laugh wave love laugh day",2011-02-14 18:32:20,1361,1,-
158,"last band concert love",2010-05-20 01:14:06,1361,1,-
158,"fun night getting up extra early tomorrow fit practice time before class",2010-09-07 04:02:06,1361,1,-
158,"wish practice french braiding laugh work",2010-04-27 21:12:54,1361,1,-
158,"number q wow really well honestly really know well shrug",2010-12-09 01:09:04,1361,1,-
158,"love being sick feel death tut",2010-05-10 19:42:48,1361,1,-
158,"woo month still date happy tut fellah",2010-04-07 03:36:06,1361,1,-
158,"drying laugh up car wishing listen laugh down vee sleeper smile fellah",2010-04-08 15:19:20,1361,1,-
158,"laugh fellah",2010-04-28 23:57:54,1361,1,-
158,"forced go school today woo national honor society obligation school probably falling asleep laugh love",2010-05-12 11:21:52,1361,1,-
158,"day start well hopefully trip awesome",2010-09-10 15:35:21,1361,1,-
158,"competition went fine laundry maybe watching new again laugh",2010-03-28 23:09:33,1361,1,-
158,"smile",2010-10-25 23:41:47,1361,1,-
158,"superintense conversation went something campus legit laugh room laugh clown doll two ancient real earth size golf ball pathetic against rest universe care something stupid music craving milk gon na watch end",2010-09-09 04:02:30,1361,1,-
158,"raw earring really gone unless someone seventh period class saw turned probably floor somewhere well time new pair treble clef fellah",2010-04-30 15:29:31,1361,1,-
158,"busy weekend laugh talent saint market competition recital earthstar church flute lesson finishing kite runner",2010-04-30 20:22:52,1361,1,-
