158,"middle attempt leave video camera decided found",2010-12-04 05:33:28,1361,1,-
158,"anyone know cheap small around jacob player",2011-01-04 03:15:51,1361,1,-
158,"somehow scrounge together eye paper today take eye final beast jury",2010-12-13 15:21:54,1361,1,-
158,"order further distract finishing theory homework unbox number tell up smile",2010-12-08 04:53:37,1361,1,-
158,"oh monday smile flute flight leave until same day laugh",2011-01-12 04:52:31,1361,1,-
158,"kind addicted welsh strawberry soda sell restore",2011-01-27 21:24:06,1361,1,-
158,"join college figured bass despise",2011-01-24 03:40:47,1361,1,-
158,"never thought d miss home much",2011-01-31 00:59:13,1361,1,-
158,"believe coming western best decision made life",2010-12-16 07:13:03,1361,1,-
158,"paper done jury done never seem sound good nervous guess e playful",2010-12-13 22:42:34,1361,1,-
158,"d prefer gemini stupid new zodiac system",2011-01-13 22:01:59,1361,1,-
158,"exactly one year ago today audition accepted school music laugh western illinois university love",2011-02-06 20:13:47,1361,1,-
158,"gon na bring new year best friend world human",2010-12-31 12:44:16,1361,1,-
158,"through first laugh day flying colors great mood now second laugh lesson studio concert band go laugh",2011-02-03 18:03:33,1361,1,-
158,"laugh take shut up",2011-01-27 02:13:35,1361,1,-
158,"one those days wish lived freshman dorm laugh out right now ah well guess time finish cleaning",2011-02-01 19:22:04,1361,1,-
158,"soon semester over come home two kella cantilena run over pronto",2011-02-14 02:20:25,1361,1,-
158,"practice piano badly bad brown",2011-01-30 01:05:25,1361,1,-
158,"weird cleaning spree completely room vacuum washed done laundry out trash nothing left clean ah",2011-02-02 19:56:35,1361,1,-
158,"movement piece stuck laugh oh concert band slay",2011-02-11 01:07:39,1361,1,-
158,"yeah march belgian paratrooper comeback",2011-02-15 20:17:39,1361,1,-
158,"dentist listening region d laugh opening night love",2010-03-04 22:32:45,1361,1,-
158,"someone e playful lain meal plan see money id first buy something",2011-02-16 05:27:28,1361,1,-
158,"fantastic mood smile now need beach make better playful",2011-02-16 17:51:22,1361,1,-
158,"tonight intensely think locked jaw now nevertheless awesome session smile",2011-02-17 00:54:50,1361,1,-
158,"camerata absolutely fantastic tonight famine props well huff articulated smile",2011-02-17 03:31:02,1361,1,-
158,"excited laugh live stream ridiculous",2011-02-18 00:17:20,1361,1,-
158,"already love song recording right now",2011-02-18 02:14:29,1361,1,-
158,"perhaps switch music business maybe one day record laugh smile laugh",2011-02-18 02:45:35,1361,1,-
158,"fantastic stream wish sort thing more love",2011-02-18 03:08:25,1361,1,-
158,"zac singing beautiful song right now laugh live laugh",2011-02-19 19:27:44,1361,1,-
158,"best friend human sweet party tonight desperately wish",2011-02-19 22:55:55,1361,1,-
158,"yes stream works glad getting watch last one best part recording now membership laugh thank daddy fuller",2011-02-20 02:33:10,1361,1,-
158,"getting up early go contemporary service umu smile",2011-02-20 03:53:33,1361,1,-
158,"nothing rally one make night more awesome love",2011-02-20 06:10:35,1361,1,-
158,"geisha epidermal",2011-02-20 18:02:29,1361,1,-
158,"two awesome day remember titano august rush smile watch epidermal more geisha laugh love",2011-02-20 21:34:31,1361,1,-
158,"time watch epidermal senior year band veldman theme show good times",2011-02-20 23:39:15,1361,1,-
158,"audition day laugh put smile today going awesome day",2011-02-21 16:14:30,1361,1,-
158,"count yourself blessed time someone down out time someone smear name discredit truth close comfort person uncomfortable glad laugh skip lamb even though laugh applaud message",2011-02-22 18:21:50,1361,1,-
158,"thinking asp lately much miss",2011-02-24 00:11:19,1361,1,-
158,"today going awesomely day nothing bring down smile",2011-02-24 13:12:58,1361,1,-
158,"laugh",2011-02-25 03:56:23,1361,1,-
158,"course concert day chapped ca play correctly awesome",2011-02-25 23:12:33,1361,1,-
158,"one win wind ensemble rock laugh",2011-02-26 03:14:59,1361,1,-
158,"good job win concert band chapped soles smile",2011-02-26 23:41:04,1361,1,-
158,"chain smile stop smile",2011-02-27 06:50:39,1361,1,-
158,"absolutely fantastic service morning incredible night last night smile",2011-02-27 15:51:17,1361,1,-
158,"sing nearly enough today",2011-02-28 00:59:32,1361,1,-
158,"",2011-02-28 09:03:31,1361,1,-
158,"best monday long time yeah think laugh",2011-02-28 22:43:02,1361,1,-
158,"days til jersey love",2011-03-01 14:57:38,1361,1,-
158,"mallet ensemble easy",2011-03-02 20:08:07,1361,1,-
158,"definitely go spring break right now homework piling up getting grr playful",2011-03-03 01:13:28,1361,1,-
158,"watching old video realizing much last year smile",2011-03-03 22:59:57,1361,1,-
158,"rain love",2011-03-04 23:54:16,1361,1,-
158,"enough english language describe amazing orchestra concert tonight",2011-03-05 03:21:05,1361,1,-
158,"well two time spring break over",2011-03-05 16:32:05,1361,1,-
158,"thank daddy fuller getting copy breaking love",2011-03-05 20:39:16,1361,1,-
158,"awesome girl night jane austin movie night cowan sticky chien smile",2011-03-06 06:19:33,1361,1,-
158,"five more days five more days home smile",2011-03-08 01:30:20,1361,1,-
158,"love maelstrom writing coloring up school laugh",2011-03-08 02:42:52,1361,1,-
158,"keep thinking week going faster actually today woke up thinking thursday",2011-03-09 19:32:03,1361,1,-
158,"stay need please",2011-03-10 03:06:02,1361,1,-
158,"ready out laugh spring break laugh faster",2011-03-10 17:24:12,1361,1,-
158,"one more day one more day ta keep telling myself one more day",2011-03-10 23:26:34,1361,1,-
158,"time tomorrow home laugh",2011-03-11 23:49:47,1361,1,-
158,"oh laugh new jersey good see again spent amazing weekend incredible guy smile",2011-03-15 13:40:01,1361,1,-
158,"see peck again weekend love",2011-03-17 01:49:21,1361,1,-
158,"impossible laugh day smile",2011-03-18 19:49:59,1361,1,-
158,"love peck much smile",2011-03-19 23:52:46,1361,1,-
158,"more days until home again recital two peck coming see play laugh",2011-03-21 03:36:27,1361,1,-
158,"today perfect day smile best mood nothing bring down",2011-03-21 15:11:38,1361,1,-
158,"peck make life much better know lived long without love never stop love",2011-03-22 17:32:32,1361,1,-
158,"see anyone see anyone smile",2011-03-25 13:06:25,1361,1,-
158,"wonderful talk practice session dinner talk dagmar laugh smile",2011-03-26 02:06:15,1361,1,-
158,"best time x cube far smile laugh",2011-03-26 17:44:40,1361,1,-
158,"laughing out loud domino delivery guy definitely hit nice",2011-03-27 00:54:56,1361,1,-
158,"recital five days ah",2011-03-28 14:45:42,1361,1,-
158,"few people seen x cube brown real decoration joke people brown real trying fake anybody out need smile",2011-03-29 17:30:57,1361,1,-
158,"break myself until sunday laugh go tut",2011-03-30 13:35:11,1361,1,-
158,"today over course still eye even go psych study guide theory homework need practice piano going long night",2011-03-31 22:52:24,1361,1,-
158,"enterprise officially ruined night giving jank car instead laugh hour now wo laugh another four thanks thanks lot",2011-04-02 02:41:56,1361,1,-
158,"fuller fuller peck left six still far away miss already love",2011-04-03 18:19:16,1361,1,-
158,"laugh watch three people love car drive away knowing wo see again until summer",2011-04-04 00:04:30,1361,1,-
158,"wind ensemble tour sleep",2011-04-06 21:23:36,1361,1,-
158,"tour over great job everyone smile",2011-04-07 23:47:57,1361,1,-
158,"very potter musical night better night smile",2011-04-09 05:04:32,1361,1,-
158,"peck pastor sermon today special smile",2011-04-10 20:30:49,1361,1,-
158,"true love come finding perfect person learning see imperfect person perfectly",2011-04-11 17:04:35,1361,1,-
158,"",2011-04-14 01:58:04,1361,1,-
158,"wonderful man laugh balance whole world perfect perfect works laugh anything laugh crazy best friend care want grow old thankful everyday live without brag little repost love peck",2011-04-14 22:51:48,1361,1,-
158,"wash wan na learn italian really badly",2011-04-17 02:21:59,1361,1,-
158,"guess owe asp laugh smile",2011-04-17 06:06:46,1361,1,-
158,"laugh lot fun embouchure opening up sound many colors never laugh myself play before great laugh",2011-04-18 17:36:38,1361,1,-
158,"next semester going",2011-04-20 17:26:05,1361,1,-
158,"wo tell anybody turn world around wo tell anyone voice favorite sound baby need parachute gon na catch fall down love",2011-04-21 15:16:22,1361,1,-
158,"top ten band ten times",2011-04-23 15:42:10,1361,1,-
158,"laugh easter risen indeed love",2011-04-24 14:59:15,1361,1,-
158,"very potter sequel please stop being final soon love",2011-04-26 14:40:16,1361,1,-
158,"once glad friday",2011-04-29 03:00:20,1361,1,-
158,"watching disnew movie totally take mind",2011-04-29 22:51:48,1361,1,-
158,"very very homesick",2011-04-30 18:22:11,1361,1,-
158,"potter day laugh",2011-05-02 13:03:53,1361,1,-
158,"th day laugh",2011-05-04 15:14:48,1361,1,-
158,"wash second flute position open new york philharmonic deadline already",2011-05-04 15:59:21,1361,1,-
158,"day officially ruined more life falling apart",2011-05-05 20:42:21,1361,1,-
158,"prepay th mother supportive figure life matter myself always laugh deal always know love baby girl getting through day much easier without know life surely gotten far love mother",2011-05-06 13:31:57,1361,1,-
158,"win love",2011-05-07 21:33:34,1361,1,-
158,"love fuller very very much ca wait see home love",2011-05-08 14:44:55,1361,1,-
158,"flute camp pandura laugh watched recital year end air bowed master aka emma remember made smile smile",2011-05-08 21:12:48,1361,1,-
158,"miss human peck wait go home final week gutta laugh one",2011-05-09 01:48:40,1361,1,-
170,"write letterleaf cute room together d name",2010-10-23 22:31:45,283,1,-
170,"ah day month wink",2011-01-16 00:41:27,283,1,-
170,"somehow someway befriend mesa everything better smile",2010-08-04 20:43:29,283,1,-
170,"answer think love wish know admit",2011-01-17 01:41:58,283,1,-
170,"ca wait tuesday happy trying laugh fit born stand out",2010-06-21 17:24:05,283,1,-
170,"sometimes laugh person world during time people try make smile disappear through keep walking ignore even though losing people little bit struggle life goes",2010-11-01 05:16:22,283,1,-
170,"laugh really need talk someone answer",2010-09-21 04:26:41,283,1,-
170,"yesterday freezing laugh today massive laugh oh yeah gon na good weekend laugh",2011-01-22 22:25:23,283,1,-
170,"laugh little brother hospital especially nine",2010-06-27 19:18:38,283,1,-
170,"mesa awesomely laugh",2010-11-09 22:29:17,283,1,-
170,"now respond phone happy victory",2010-05-27 03:39:53,283,1,-
170,"h m love",2010-11-30 15:34:39,283,1,-
170,"still need costume d much better wrap yourself toilet paper going party city",2010-10-28 23:23:15,283,1,-
170,"r p many much want ca bring back",2010-11-23 22:31:19,283,1,-
170,"laugh went through lot update status laugh write wall laugh",2010-10-11 05:13:57,283,1,-
170,"keep sending those write status smile",2010-12-10 03:39:25,283,1,-
170,"waiting particular soccer game excited turns out today day work goo ugh",2010-09-21 14:28:54,283,1,-
170,"damnii breaking emilia rampire text crude out status tell dislike confession first impression p s everyone met written miss tell lost track write one people going saturday",2010-07-15 15:43:27,283,1,-
170,"laugh",2010-11-07 05:51:19,283,1,-
170,"dude barely laugh sorry actually working",2010-07-22 17:49:12,283,1,-
170,"see everyone saturday laugh pay cough essay cough laugh",2010-07-12 19:01:14,283,1,-
170,"die today laugh long keep whispering name memory shall live die vain whisper name through out story good reason need figure out",2010-10-27 02:03:33,283,1,-
170,"cocaine gay needs come out closet smile",2010-07-29 18:45:01,283,1,-
170,"mamma again tell dislike confession first impression smile plus tell good memory",2010-09-22 04:55:11,283,1,-
170,"poke crush status think good friend message relationship comment good see brave enough copy paste status three people poking already count smile war",2010-08-05 17:32:58,283,1,-
170,"d need befriend laugh stuck again",2010-08-06 05:07:26,283,1,-
170,"status tell one thing one dislike confession first impression p s met written miss tell love",2010-07-15 15:29:15,283,1,-
170,"amazing look someone straight completely lie funny thing know lying",2011-01-09 05:23:20,283,1,-
170,"monday pancake house laugh laugh pancake blankite christian",2010-07-21 03:01:38,283,1,-
170,"gonzalo made life complete love laugh",2010-08-13 16:19:44,283,1,-
170,"answer following cute dress see future love chill kiss marry first impression",2011-01-14 04:48:44,283,1,-
170,"still remember face monster truck went smile",2010-10-10 02:46:19,283,1,-
170,"saw class beatus car ca go past mah rolled down window lawton wanting smile",2010-12-23 01:18:25,283,1,-
170,"laugh birthday smile",2010-08-28 05:29:43,283,1,-
170,"truth laugh",2010-10-03 01:45:56,283,1,-
170,"love",2011-01-29 00:04:58,283,1,-
170,"laugh days feel good relax enjoy smile",2011-01-20 20:36:45,283,1,-
170,"love person love fact met trust one beset love",2010-12-10 03:42:05,283,1,-
170,"man ca wait tomorrow smile excited ca believe",2011-01-08 05:14:03,283,1,-
170,"send number between through post something status laugh",2010-12-09 01:45:42,283,1,-
170,"dude barely found out last name laugh ta love smile poke one more time know evil",2010-08-06 20:39:33,283,1,-
170,"problem between lack communication want talk ear otherwise continue walking single word act complete",2011-01-28 01:50:42,283,1,-
170,"normally asleep right now laugh dress party uncle pretty much wasted laugh fun laugh",2010-12-12 09:16:30,283,1,-
170,"smile",2010-09-07 14:29:22,283,1,-
170,"gon na unload photo tomorrow gon na take awhile essay telling go sleep ugh still mad ca give hug saturday laugh miss everyone ni love love know best days life spent",2010-07-13 04:26:27,283,1,-
170,"laugh honestly favorite holiday love ca wait today yesterday fun today gon na amazing laugh oh laugh laugh everyone laugh",2010-10-31 20:07:33,283,1,-
170,"next wednesday blankite day love finally",2010-12-21 18:02:16,283,1,-
170,"damn best birthday smile out work early school tomorrow laugh lucky",2011-02-01 20:39:52,283,1,-
170,"physics still loving eegrass love finished homework smile",2010-08-30 04:18:13,283,1,-
170,"status tell comes mind laugh name laugh really tired people down cousin make look worse",2010-07-22 03:56:21,283,1,-
170,"tell something always tell stays between put status see laugh",2010-10-26 14:27:32,283,1,-
170,"really wish working wednesday best outing work sigh",2010-07-25 06:55:25,283,1,-
170,"love ma malaria amazing photo best love",2010-07-13 03:20:27,283,1,-
170,"looking forward laugh aunt come probably gon na rock especially come wink",2011-01-17 01:08:07,283,1,-
170,"actually fun yesterday night smile love even coat check fun bit",2010-09-26 18:30:42,283,1,-
170,"need something laugh go sleep laugh someone bedtime story",2011-01-23 06:26:44,283,1,-
170,"ah love thanks made laugh today well considering time yesterday laugh d thanks",2010-06-13 06:39:18,283,1,-
170,"ah ca wait saturday love",2010-06-11 00:44:33,283,1,-
170,"happy wednesday now laugh",2010-09-28 22:04:39,283,1,-
170,"meet copy status see",2010-09-28 18:57:15,283,1,-
170,"love blankite love te extra santo awesome gummy need love",2010-05-27 21:26:24,283,1,-
170,"love going lake night smile",2010-08-31 06:02:14,283,1,-
170,"before tell along good memory year laugh",2010-12-29 23:52:11,283,1,-
170,"laugh again laugh",2011-01-04 22:33:20,283,1,-
170,"post friend good memory dislike admit something sweet smile",2010-11-08 16:26:04,283,1,-
170,"apparently nice nice probably laugh",2010-09-05 02:21:12,283,1,-
170,"learned today matter ca always make right ca always e playful act laugh try work bad take need work laugh want good reason",2010-11-22 02:55:51,283,1,-
170,"love three liking spree laugh",2011-02-08 22:46:16,283,1,-
170,"finally new phone smile same number text ask laugh",2010-09-15 04:09:28,283,1,-
170,"snow good use burying brother much fun laugh",2011-02-02 21:27:08,283,1,-
170,"thing surviving through day going game love",2011-01-18 21:40:25,283,1,-
170,"yes caucho met debate thingy laugh carajas universe love",2010-07-14 14:47:26,283,1,-
170,"going sunday ugh really feel going work tomorrow people wrote miss tell lost track status dislike first impression confession laugh",2010-07-16 03:01:21,283,1,-
170,"being fun boring",2010-12-14 18:21:06,283,1,-
170,"think cute status love put friend put smile want go out put laugh miss put crush put laugh post status smile",2010-10-04 20:15:54,283,1,-
170,"d really love people stop one photo probably gon na delete now",2010-07-30 23:19:45,283,1,-
170,"still think care smile",2010-12-13 05:16:37,283,1,-
170,"describe disappointment except one cuss",2011-01-23 23:16:39,283,1,-
170,"universe love",2010-07-13 16:33:50,283,1,-
170,"today love ca wait ca wait tomorrow smile",2010-07-17 17:02:19,283,1,-
170,"see group notice particular think hot cute turn around notice laugh laugh",2010-07-23 21:31:49,283,1,-
170,"never try going casebook baby girl crying arms drop phone hit porto",2010-08-06 00:21:00,283,1,-
170,"past four days amazing unforgeable ca thanks enough everybody met taught made laugh now find everybody met augustan smile",2010-07-12 15:54:23,283,1,-
170,"laugh hyper today great day laugh amazing start amazing weekend smile",2010-10-30 04:39:00,283,1,-
170,"felix mi",2010-12-12 18:55:38,283,1,-
170,"up tell happy birthday laugh",2010-07-29 04:43:05,283,1,-
170,"really care going sunday forget sleeping whole day laugh now ask go",2010-07-15 14:19:44,283,1,-
170,"ah laugh love people laugh love",2010-07-17 23:05:17,283,1,-
170,"creeper out house alone working paper people downstairs barely homesome trying come house walking up basically",2010-10-04 04:27:39,283,1,-
170,"damnii pancake next monday now second august crap gon na august",2010-07-22 00:28:09,283,1,-
170,"really slow",2010-07-21 14:52:52,283,1,-
170,"saw fifty jelly thought good times laugh popcorn",2010-07-22 17:53:24,283,1,-
170,"work day over laugh",2010-11-08 22:45:10,283,1,-
170,"gon na watch game",2011-01-23 17:54:08,283,1,-
170,"keep poking calm now laugh smile",2010-08-12 20:35:40,283,1,-
170,"ill write letter smile cute make feel d name tattoo",2010-08-06 21:54:26,283,1,-
170,"today train work ugh creepy people city",2010-07-16 14:53:57,283,1,-
170,"nothing impossible word itself possible capable everything set mind",2010-07-25 01:38:02,283,1,-
170,"stays positive smile befriend keep sane hopefully still go",2010-08-18 03:32:58,283,1,-
170,"done done smile need talk someone",2010-08-10 23:09:31,283,1,-
170,"marry someone casebook smile one use lie hide",2010-07-29 18:42:18,283,1,-
170,"now know smile love befriend love laugh ad war coming up laugh see three",2010-08-04 22:14:19,283,1,-
170,"never keep crabby over lesson day",2010-07-24 21:39:17,283,1,-
170,"love make day smile",2011-01-13 00:57:04,283,1,-
170,"albino smile damn",2010-11-23 04:19:44,283,1,-
170,"dude really poke war",2010-08-05 17:22:28,283,1,-
170,"ah tuesday worker",2010-08-18 17:34:54,283,1,-
170,"bought trophy back home ca stop being laugh past four days amazing love miss everyone already smile",2010-07-12 02:31:36,283,1,-
170,"baby cousin cute smile new favorite laugh love nothing laugh brother cousin keeping up smile",2010-08-21 03:59:34,283,1,-
170,"annoy people poking now one getting laugh",2010-08-11 21:56:50,283,1,-
170,"carnival laugh amount people go smile",2010-09-20 00:47:44,283,1,-
170,"laugh those days work absolutely nothing falling asleep ca wait leave go home ready leave movie family again smile",2010-08-04 20:28:04,283,1,-
170,"day went better e playful smile those days nothing went wrong laugh well",2010-07-20 23:46:42,283,1,-
170,"maybe right know situation getting better",2010-08-11 00:03:52,283,1,-
170,"done carmele smile",2010-08-20 18:20:05,283,1,-
170,"idgah still best city city always fan love",2011-01-23 23:31:59,283,1,-
170,"math homework o first fun myself laugh",2011-01-28 00:32:05,283,1,-
170,"yes true made really care done smile people try put down simply smile walk away tired going laugh",2010-07-28 15:11:35,283,1,-
170,"gone well feeling sometimes little great impact mine negative way better prepared people second",2010-09-14 03:50:03,283,1,-
170,"today good laugh",2011-01-25 22:43:09,283,1,-
170,"status tell something learned looking wall color remind first memory animal remind ask something always favorite thing give weird nickname smile ge post smile",2010-10-12 18:51:25,283,1,-
170,"birthday one smile mamma smack wink",2010-08-05 01:40:07,283,1,-
170,"gon na bad day work tomorrow first best friend birthday second weather gon na killer",2010-10-26 05:15:22,283,1,-
170,"one more poke wo very much consider laugh",2010-08-06 17:15:51,283,1,-
170,"smart studied confident pass those exam awesome know exam take challenge beat",2010-12-15 04:39:15,283,1,-
170,"family craziness yeah laugh",2010-11-28 05:36:43,283,1,-
170,"pancake tomorrow sad sorry everyone make",2010-08-02 03:23:36,283,1,-
170,"motto tuesday working grr",2010-08-19 16:07:26,283,1,-
170,"done work day smile",2010-10-04 21:42:00,283,1,-
170,"love caucho gon na go national rock smile luckily paying",2010-09-05 02:10:30,283,1,-
170,"make whole day laugh love made smile day love",2010-11-09 02:46:09,283,1,-
170,"ah pancake today great smile gon na hit went beach great day smile still needs",2010-08-17 04:24:29,283,1,-
170,"barely ca go sleep simply ca d need wednesday",2010-09-28 04:12:31,283,1,-
170,"love marcia love",2011-02-09 03:13:06,283,1,-
170,"go going smile",2010-10-02 20:57:32,283,1,-
170,"super gorgeous quince awesome smile corral good smile gorgeous",2010-08-29 18:05:22,283,1,-
170,"reballot bubble wrap smile love laugh turn anything smile even lie need date smile",2010-09-21 02:36:00,283,1,-
170,"flores laugh laugh",2010-10-26 21:36:18,283,1,-
170,"love",2010-09-26 00:02:11,283,1,-
170,"going enjoy day smile saturday gon na blast smile week gon na rock laugh",2010-09-29 18:28:57,283,1,-
170,"love eegrass love drama best real life",2010-08-30 03:08:59,283,1,-
170,"awesome smile",2010-11-09 21:53:24,283,1,-
170,"seeing small coggie trying look tough dog x size smile",2010-09-05 01:09:01,283,1,-
170,"thankful mother thankful thankful family thankful thankful school even though barely time laugh meet amazing people thankful everyone met everyone made laugh everyone laugh out everyone never left accepted still love love thankful life",2010-11-26 00:26:19,283,1,-
170,"sometimes life take turn imagine possible worst reality amazing thing laugh",2010-11-25 04:59:17,283,1,-
170,"screw rate along something love",2010-12-01 06:08:47,283,1,-
170,"st last name day write wall week write love wall th answer question th sing song see th tell post brave enough",2011-01-22 05:54:32,283,1,-
170,"completely honest ask one question unbox total honesty dare put status see people ask",2010-10-05 14:46:56,283,1,-
170,"love watching aunt try laugh laugh love smile",2010-10-05 18:48:31,283,1,-
170,"love first snowfall big annual snowball fight brother laugh",2010-12-04 21:52:45,283,1,-
170,"couch floor bed closet wink",2010-10-07 03:13:02,283,1,-
170,"truth",2010-11-03 03:18:54,283,1,-
170,"imperfection beauty madness genius better absolutely ridiculous absolutely boring one favorite laugh",2011-01-24 15:21:08,283,1,-
170,"highlight day taking mouth shut physics looking pretty laugh according being overly dramatic mother losing ring getting five second laugh attack realizing laugh finding take damn christmas photo doing amazing global laugh someone make smile love",2010-11-05 03:30:50,283,1,-
170,"made smile life set status see many people made smile smile",2010-10-23 21:51:51,283,1,-
170,"love friend smile",2010-10-19 21:01:33,283,1,-
170,"huge laugh amazingly friend laugh smile",2010-10-08 03:07:46,283,1,-
170,"laugh decade ca forget birthday smile",2011-01-31 05:13:58,283,1,-
170,"laugh birthday banda fly love",2010-11-07 05:28:18,283,1,-
170,"swear break boycott eegrass ugh cute die",2011-01-30 19:46:05,283,1,-
170,"want talk someone rarely communicate laugh",2011-02-09 02:37:48,283,1,-
170,"laugh situation nation nobody made feel way know motivation given reputation love thank getting song laugh laugh",2010-11-29 06:16:05,283,1,-
170,"wan na married someone casebook laugh",2010-10-24 21:14:55,283,1,-
170,"felix cavidae everyone love wish best hope spend well know smile",2010-12-25 07:40:08,283,1,-
170,"see up ya laugh",2010-11-14 07:06:30,283,1,-
170,"totally passing world history test tomorrow smile ma keep c love writing over wall love",2010-11-18 02:56:23,283,1,-
170,"today actually good day laugh",2010-10-26 17:42:32,283,1,-
170,"today national mad day even smile everyone still fed up mood today better mamma hopefully coach laugh",2010-11-13 02:39:48,283,1,-
170,"before want know",2010-12-30 22:59:09,283,1,-
170,"tell holding back truth know",2010-12-07 04:42:32,283,1,-
170,"laugh time rest",2011-02-17 19:25:39,283,1,-
170,"lack sleep bound point being love el doctorate rakit y henry con size smile beast song",2011-02-18 02:50:44,283,1,-
170,"everyone gloomy",2011-02-18 03:09:11,283,1,-
170,"pinball love",2011-02-18 03:12:42,283,1,-
170,"ay notion love chino nach y deserved chino y nach smile",2011-02-18 03:29:08,283,1,-
170,"turns out cousin debater laugh made especially saw debate first time grow up fast tear tear",2010-11-13 23:42:20,283,1,-
170,"love grecian face laugh out laugh",2010-11-02 18:50:06,283,1,-
170,"missing piece puzzle without incomplete",2011-02-21 00:27:58,283,1,-
170,"being judge laugh",2010-11-13 23:35:21,283,1,-
